file_name,card_no,bird_name,vo_id,transcript,duration_seconds,detected_language,language_probability,error,bird_audio_bird_name,bird_audio_clip_count,bird_audio_clip_files,bird_audio_main_files
181_Eurasian_Magpie_VO_1_PL.wav,181,Eurasian Magpie,1_PL,"Srockas Vetaina. Weddug Badan, Srockas Vetaina doruvnoyo pojoem Intelegancy maupom chwekokstautnem.",8.545,en,1.000000,,Eurasian Magpie,2,src/AudioClip/181_Eurasian_Magpie_181606_2_call.m4a|src/AudioClip/181_Eurasian_Magpie_181606_3_call_main.m4a,src/AudioClip/181_Eurasian_Magpie_181606_3_call_main.m4a
182_Carrion_Crow_VO_1 #9154.wav,182,Carrion Crow,1 #9154,"Hello, everyone. Thanks for watching. Please like, subscribe, and share.",8.668,en,1.000000,,Carrion Crow,4,src/AudioClip/182_Carrion_Crow_281728_1_call.m4a|src/AudioClip/182_Carrion_Crow_281728_2_call.m4a|src/AudioClip/182_Carrion_Crow_281728_3_call_main.m4a|src/AudioClip/182_Carrion_Crow_281728_4_call.m4a,src/AudioClip/182_Carrion_Crow_281728_3_call_main.m4a
182_Carrion_Crow_VO_1_PL.wav,182,Carrion Crow,1_PL,"Turn-o-vron. If you want to learn more about turn-o-vron, turn-o-vron is one of the most important things in the world. I hope you enjoy it.",10.189,en,1.000000,,Carrion Crow,4,src/AudioClip/182_Carrion_Crow_281728_1_call.m4a|src/AudioClip/182_Carrion_Crow_281728_2_call.m4a|src/AudioClip/182_Carrion_Crow_281728_3_call_main.m4a|src/AudioClip/182_Carrion_Crow_281728_4_call.m4a,src/AudioClip/182_Carrion_Crow_281728_3_call_main.m4a
183_Griffon_Vulture_VO_1 #22035.wav,183,Griffon Vulture,1 #22035,"Oh yeah, tochiyo. Zhexian nial, guan tbututu de nao dai, nangopan zhutamen, diaojie ti wen.",7.620,en,1.000000,,Griffon Vulture,2,src/AudioClip/183_Griffon_Vulture_XC423927_1_call_main.m4a|src/AudioClip/183_Griffon_Vulture_XC423927_2_call.m4a,src/AudioClip/183_Griffon_Vulture_XC423927_1_call_main.m4a
183_Griffon_Vulture_VO_1_PL.wav,183,Griffon Vulture,1_PL,Do not forget to leave a comment below. Do not forget to leave a comment below. Do not forget to leave a comment below.,8.455,en,1.000000,,Griffon Vulture,2,src/AudioClip/183_Griffon_Vulture_XC423927_1_call_main.m4a|src/AudioClip/183_Griffon_Vulture_XC423927_2_call.m4a,src/AudioClip/183_Griffon_Vulture_XC423927_1_call_main.m4a
184_Coal_Tit_VO_1 #10230.wav,184,Coal Tit,1 #10230,"Hello everyone, welcome to my channel, my channel is called Unishina Jones. Today I am going to show you how to control the Coal Tit.",11.270,en,1.000000,,Coal Tit,3,src/AudioClip/184_Coal_Tit_248918_1_call.m4a|src/AudioClip/184_Coal_Tit_248918_2_call.m4a|src/AudioClip/184_Coal_Tit_248918_4_call_main.m4a,src/AudioClip/184_Coal_Tit_248918_4_call_main.m4a
184_Coal_Tit_VO_1_PL.wav,184,Coal Tit,1_PL,Sosnufka. Sosnufky. Magazinuyo nashonashvierka atasem lavet beskrengov cenajima.,7.967,en,1.000000,,Coal Tit,3,src/AudioClip/184_Coal_Tit_248918_1_call.m4a|src/AudioClip/184_Coal_Tit_248918_2_call.m4a|src/AudioClip/184_Coal_Tit_248918_4_call_main.m4a,src/AudioClip/184_Coal_Tit_248918_4_call_main.m4a
185_Eurasian_Nuthatch_VO_1 #16491.wav,185,Eurasian Nuthatch,1 #16491,"Ciao Fuxi. Zhenxian Naur, Jing Zhang, Liu Zhong, Munao, Qi Zhezhe Shudong, Lai Yingchao.",7.044,en,1.000000,,Eurasian Nuthatch,3,src/AudioClip/185_Eurasian_Nuthatch_14766_1_call.m4a|src/AudioClip/185_Eurasian_Nuthatch_14766_2_call.m4a|src/AudioClip/185_Eurasian_Nuthatch_14766_3_call_main.m4a,src/AudioClip/185_Eurasian_Nuthatch_14766_3_call_main.m4a
185_Eurasian_Nuthatch_VO_1_PL.wav,185,Eurasian Nuthatch,1_PL,Kovalik zwetayne. Kovalik zwetayne turns to zakwadayong nyaz davstarek duplak jintiaof.,8.054,en,1.000000,,Eurasian Nuthatch,3,src/AudioClip/185_Eurasian_Nuthatch_14766_1_call.m4a|src/AudioClip/185_Eurasian_Nuthatch_14766_2_call.m4a|src/AudioClip/185_Eurasian_Nuthatch_14766_3_call_main.m4a,src/AudioClip/185_Eurasian_Nuthatch_14766_3_call_main.m4a
186_Eurasian_Nutcracker_VO_1 #16386.wav,186,Eurasian Nutcracker,1 #16386,"Xingya. Zhiguanze. Xingya, we will let you down, Zhongze. We will let you down, Zhongze.",8.453,en,1.000000,,Eurasian Nutcracker,4,src/AudioClip/186_Eurasian_Nutcracker_53560_1_call.m4a|src/AudioClip/186_Eurasian_Nutcracker_53560_2_call.m4a|src/AudioClip/186_Eurasian_Nutcracker_53560_3_call.m4a|src/AudioClip/186_Eurasian_Nutcracker_53560_4_call_main.m4a,src/AudioClip/186_Eurasian_Nutcracker_53560_4_call_main.m4a
186_Eurasian_Nutcracker_VO_1_PL.wav,186,Eurasian Nutcracker,1_PL,Ože hõfka zwet aina. Ože hõfka zon stanypokonat navet trudysti dvakilometre abesnalesti otopoviednimiei stedopsechovivvanya nachen.,10.298,en,1.000000,,Eurasian Nutcracker,4,src/AudioClip/186_Eurasian_Nutcracker_53560_1_call.m4a|src/AudioClip/186_Eurasian_Nutcracker_53560_2_call.m4a|src/AudioClip/186_Eurasian_Nutcracker_53560_3_call.m4a|src/AudioClip/186_Eurasian_Nutcracker_53560_4_call_main.m4a,src/AudioClip/186_Eurasian_Nutcracker_53560_4_call_main.m4a
187_Red_backed_Shrike_VO_1 #32396.wav,187,Red backed Shrike,1 #32396,"Hong bai boa lau. Zhe jie tuo fu niao. Hui liung jing ji he tai zu da tie zu wan, lai chu chu chan shi wu.",7.760,en,1.000000,,Red Backed Shrike,5,src/AudioClip/187_Red_backed_Shrike_281704_1_call.m4a|src/AudioClip/187_Red_backed_Shrike_281704_2_call_main.m4a|src/AudioClip/187_Red_backed_Shrike_281704_3_call.m4a|src/AudioClip/187_Red_backed_Shrike_281704_4_call.m4a|src/AudioClip/187_Red_backed_Shrike_281704_5_call.m4a,src/AudioClip/187_Red_backed_Shrike_281704_2_call_main.m4a
187_Red_backed_Shrike_VO_1_PL.wav,187,Red backed Shrike,1_PL,"Goanshorek. Goanshoreki, préjavuion zivnost, nadevaiontion nadrute kortraste ich ernia.",8.098,en,1.000000,,Red Backed Shrike,5,src/AudioClip/187_Red_backed_Shrike_281704_1_call.m4a|src/AudioClip/187_Red_backed_Shrike_281704_2_call_main.m4a|src/AudioClip/187_Red_backed_Shrike_281704_3_call.m4a|src/AudioClip/187_Red_backed_Shrike_281704_4_call.m4a|src/AudioClip/187_Red_backed_Shrike_281704_5_call.m4a,src/AudioClip/187_Red_backed_Shrike_281704_2_call_main.m4a
188_Common_Kingfisher_VO_1 #11353.wav,188,Common Kingfisher,1 #11353,"Please, let me know your thoughts on this video. I hope you enjoy this video. I hope you enjoy it.",10.502,en,1.000000,,Common Kingfisher,4,src/AudioClip/188_Common_Kingfisher_56433_1_call.m4a|src/AudioClip/188_Common_Kingfisher_56433_2_call.m4a|src/AudioClip/188_Common_Kingfisher_56433_3_call.m4a|src/AudioClip/188_Common_Kingfisher_56433_4_call_main.m4a,src/AudioClip/188_Common_Kingfisher_56433_4_call_main.m4a
188_Common_Kingfisher_VO_1_PL.wav,188,Common Kingfisher,1_PL,I want to thank you for your support. I want to thank you for your support.,8.464,en,1.000000,,Common Kingfisher,4,src/AudioClip/188_Common_Kingfisher_56433_1_call.m4a|src/AudioClip/188_Common_Kingfisher_56433_2_call.m4a|src/AudioClip/188_Common_Kingfisher_56433_3_call.m4a|src/AudioClip/188_Common_Kingfisher_56433_4_call_main.m4a,src/AudioClip/188_Common_Kingfisher_56433_4_call_main.m4a
189_Little_Owl_VO_1 #25789.wav,189,Little Owl,1 #25789,"Hello everyone, I am Fuxiao Xiao. I am going to show you some of my favorite things about Little Owl.",7.450,en,1.000000,,Little Owl,4,src/AudioClip/189_Little_Owl_8351_1_call.m4a|src/AudioClip/189_Little_Owl_8351_2_call.m4a|src/AudioClip/189_Little_Owl_8351_3_call.m4a|src/AudioClip/189_Little_Owl_8351_4_call_main.m4a,src/AudioClip/189_Little_Owl_8351_4_call_main.m4a
189_Little_Owl_VO_1_PL.wav,189,Little Owl,1_PL,Do you have any questions? Do you have any questions? Do you have any questions?,7.393,en,1.000000,,Little Owl,4,src/AudioClip/189_Little_Owl_8351_1_call.m4a|src/AudioClip/189_Little_Owl_8351_2_call.m4a|src/AudioClip/189_Little_Owl_8351_3_call.m4a|src/AudioClip/189_Little_Owl_8351_4_call_main.m4a,src/AudioClip/189_Little_Owl_8351_4_call_main.m4a
18_Horned_Lark_VO_1_PL.wav,18,Horned Lark,1_PL,Gornetags wettayne. Gornetags wettayne tfor jevial kevendrov nestada sptakami innevdatonkov.,9.000,en,1.000000,,Horned Lark,4,src/AudioClip/18_Horned_Lark_134110_1_song.m4a|src/AudioClip/18_Horned_Lark_134110_2_call.m4a|src/AudioClip/18_Horned_Lark_134110_3_call.m4a|src/AudioClip/18_Horned_Lark_134110_4_song_main.m4a,src/AudioClip/18_Horned_Lark_134110_4_song_main.m4a
18_Horned_Lark_VO_2 #22745.wav,18,Horned Lark,2 #22745,John Belling. John Belling is a,5.882,en,1.000000,,Horned Lark,4,src/AudioClip/18_Horned_Lark_134110_1_song.m4a|src/AudioClip/18_Horned_Lark_134110_2_call.m4a|src/AudioClip/18_Horned_Lark_134110_3_call.m4a|src/AudioClip/18_Horned_Lark_134110_4_song_main.m4a,src/AudioClip/18_Horned_Lark_134110_4_song_main.m4a
190_Eurasian_Jay_VO_1 #15885.wav,190,Eurasian Jay,1 #15885,"Zhongya, wolokodong jeshenyar hui yunisian twen ji xiangzi.",5.922,en,1.000000,,Eurasian Jay,4,src/AudioClip/190_Eurasian_Jay_68728_1_call.m4a|src/AudioClip/190_Eurasian_Jay_68728_2_call.m4a|src/AudioClip/190_Eurasian_Jay_68728_3_call.m4a|src/AudioClip/190_Eurasian_Jay_68728_4_call_main.m4a,src/AudioClip/190_Eurasian_Jay_68728_4_call_main.m4a
190_Eurasian_Jay_VO_1_PL.wav,190,Eurasian Jay,1_PL,Soy kasvetaina. Soy kisvetaina plan nuyo zaspokoyenies foy ik przyshwek potrzep gromadzons rovenjana jima.,9.404,en,1.000000,,Eurasian Jay,4,src/AudioClip/190_Eurasian_Jay_68728_1_call.m4a|src/AudioClip/190_Eurasian_Jay_68728_2_call.m4a|src/AudioClip/190_Eurasian_Jay_68728_3_call.m4a|src/AudioClip/190_Eurasian_Jay_68728_4_call_main.m4a,src/AudioClip/190_Eurasian_Jay_68728_4_call_main.m4a
191_White_Stork_VO_1 #43583.wav,191,White Stork,1 #43583,"Hi, I'm Gwen. I'm the owner of White Stork. I'm the owner of White Stork.",6.877,en,1.000000,,White Stork,3,src/AudioClip/191_White_Stork_416686_1_call.m4a|src/AudioClip/191_White_Stork_416686_2_call.m4a|src/AudioClip/191_White_Stork_416686_3_call_main.m4a,src/AudioClip/191_White_Stork_416686_3_call_main.m4a
191_White_Stork_VO_1_PL.wav,191,White Stork,1_PL,"Bochan Białin. Wie wiel usta rozhut nech kulturach, bochan bie wie zimballa mi zhicha iru ginen.",7.814,en,1.000000,,White Stork,3,src/AudioClip/191_White_Stork_416686_1_call.m4a|src/AudioClip/191_White_Stork_416686_2_call.m4a|src/AudioClip/191_White_Stork_416686_3_call_main.m4a,src/AudioClip/191_White_Stork_416686_3_call_main.m4a
192_White_throated_Dipper_VO_1 #43676.wav,192,White throated Dipper,1 #43676,"Is this the end of the video? If you like this video, please like, share and subscribe to our channel. Thank you so much for watching!",10.483,en,1.000000,,White Throated Dipper,4,src/AudioClip/192_White_throated_Dipper_XC633228_1_call_main.m4a|src/AudioClip/192_White_throated_Dipper_XC633228_2_call_.m4a|src/AudioClip/192_White_throated_Dipper_XC633228_3_call.m4a|src/AudioClip/192_White_throated_Dipper_XC633228_4_call.m4a,src/AudioClip/192_White_throated_Dipper_XC633228_1_call_main.m4a
192_White_throated_Dipper_VO_1_PL.wav,192,White throated Dipper,1_PL,Plusht zwet eine. Plusht zwet eine to jedene vistam puyantsef polsteptakshpivayantse potravianse puyvach inurkowach.,9.520,en,1.000000,,White Throated Dipper,4,src/AudioClip/192_White_throated_Dipper_XC633228_1_call_main.m4a|src/AudioClip/192_White_throated_Dipper_XC633228_2_call_.m4a|src/AudioClip/192_White_throated_Dipper_XC633228_3_call.m4a|src/AudioClip/192_White_throated_Dipper_XC633228_4_call.m4a,src/AudioClip/192_White_throated_Dipper_XC633228_1_call_main.m4a
193_Black_throated_Diver_VO_1 #5790.wav,193,Black throated Diver,1 #5790,"Hello, I'm Tian Niao. I've been working with the company for a long time, and I've been working with the company for a long time.",8.859,en,1.000000,,Black Throated Diver,3,src/AudioClip/193_Black_throated_Diver_911_1_call.m4a|src/AudioClip/193_Black_throated_Diver_911_2_call.m4a|src/AudioClip/193_Black_throated_Diver_911_3_call.m4a,
193_Black_throated_Diver_VO_1_PL.wav,193,Black throated Diver,1_PL,"Noor Tarnoshy. Zamish Koyantse pov nozno erazia Noor Tarnoshy. Gnez du ein nai joraxvotko vodnik, vodlegoshti metra adobzago.",11.540,en,1.000000,,Black Throated Diver,3,src/AudioClip/193_Black_throated_Diver_911_1_call.m4a|src/AudioClip/193_Black_throated_Diver_911_2_call.m4a|src/AudioClip/193_Black_throated_Diver_911_3_call.m4a,
194_Wilsons_Storm_Petrel_VO_1 #44741.wav,194,Wilsons Storm Petrel,1 #44741,"Hwang poo yang hai yan. Zhe zhong niao feng poo guang fang, shu lang keg wan. Dang heng shao chu xian zai yan me da shi xian zhong. Ning we doo shu shi ho, tam me doo shi ho zi hai xiang.",11.366,en,1.000000,,Wilsons Storm Petrel,4,src/AudioClip/194_Wilsons_Storm_Petrel_51676_1_call.m4a|src/AudioClip/194_Wilsons_Storm_Petrel_51676_2_call.m4a|src/AudioClip/194_Wilsons_Storm_Petrel_51676_3_call.m4a|src/AudioClip/194_Wilsons_Storm_Petrel_51676_4_call_main.m4a,src/AudioClip/194_Wilsons_Storm_Petrel_51676_4_call_main.m4a
194_Wilsons_Storm_Petrel_VO_1_PL.wav,194,Wilsons Storm Petrel,1_PL,"It's not a good thing to do this. We've been waiting for this for a long time. We've been waiting for this for a long time, but we've been waiting for this for a long time.",12.428,en,1.000000,,Wilsons Storm Petrel,4,src/AudioClip/194_Wilsons_Storm_Petrel_51676_1_call.m4a|src/AudioClip/194_Wilsons_Storm_Petrel_51676_2_call.m4a|src/AudioClip/194_Wilsons_Storm_Petrel_51676_3_call.m4a|src/AudioClip/194_Wilsons_Storm_Petrel_51676_4_call_main.m4a,src/AudioClip/194_Wilsons_Storm_Petrel_51676_4_call_main.m4a
195_Great_Crested_Grebe_VO_1 #20201.wav,195,Great Crested Grebe,1 #20201,"Fung tau pieti. Fung tau pieti fu fu hu ei ge zi shan chu tā me zhui xi huà nà chu nào, bing dan du fu yàng.",8.286,en,1.000000,,Great Crested Grebe,3,src/AudioClip/195_Great_Crested_Grebe_280990_call_1_main.m4a|src/AudioClip/195_Great_Crested_Grebe_280990_call_2.m4a|src/AudioClip/195_Great_Crested_Grebe_280990_call_3.m4a,src/AudioClip/195_Great_Crested_Grebe_280990_call_1_main.m4a
195_Great_Crested_Grebe_VO_1_PL.wav,195,Great Crested Grebe,1_PL,Percoces du Voutube. Rodice Percoces du Voutube go vivirions foye olubiane pisclenta y vejovuyo me osobno.,8.934,en,1.000000,,Great Crested Grebe,3,src/AudioClip/195_Great_Crested_Grebe_280990_call_1_main.m4a|src/AudioClip/195_Great_Crested_Grebe_280990_call_2.m4a|src/AudioClip/195_Great_Crested_Grebe_280990_call_3.m4a,src/AudioClip/195_Great_Crested_Grebe_280990_call_1_main.m4a
196_Common_Little_Bittern_VO_1 #11451.wav,196,Common Little Bittern,1 #11451,"Hello, my friends. My name is Lu Ke, and I am the director of the",7.716,en,1.000000,,Common Little Bittern,4,src/AudioClip/196_Common_Little_Bittern24888_1_call.m4a|src/AudioClip/196_Common_Little_Bittern24888_2_call.m4a|src/AudioClip/196_Common_Little_Bittern24888_3_call.m4a|src/AudioClip/196_Common_Little_Bittern24888_4_call_main.m4a,src/AudioClip/196_Common_Little_Bittern24888_4_call_main.m4a
196_Common_Little_Bittern_VO_1_PL.wav,196,Common Little Bittern,1_PL,Bontrex witt eine. Bontrex witt eine ist iednem snei meinei schu gat un kauf traplie. Dwo gost jego chawat dor zalad wiet zu gisti oschemt sente metruv.,10.913,en,1.000000,,Common Little Bittern,4,src/AudioClip/196_Common_Little_Bittern24888_1_call.m4a|src/AudioClip/196_Common_Little_Bittern24888_2_call.m4a|src/AudioClip/196_Common_Little_Bittern24888_3_call.m4a|src/AudioClip/196_Common_Little_Bittern24888_4_call_main.m4a,src/AudioClip/196_Common_Little_Bittern24888_4_call_main.m4a
197_Squacco_Heron_VO_1 #39804.wav,197,Squacco Heron,1 #39804,B'ai qi huang xi lu. Zai ji xin qi oo bia yan xi. Xiong xing b'ai qi huang xi lu. Huaxu qi tamayi xi ochang arye ndi de yu mao.,9.719,en,1.000000,,Squacco Heron,4,src/AudioClip/197_Squacco_Heron_299966_1_call.m4a|src/AudioClip/197_Squacco_Heron_299966_2_call.m4a|src/AudioClip/197_Squacco_Heron_299966_3_call.m4a|src/AudioClip/197_Squacco_Heron_299966_4_call_main.m4a,src/AudioClip/197_Squacco_Heron_299966_4_call_main.m4a
197_Squacco_Heron_VO_1_PL.wav,197,Squacco Heron,1_PL,"Tapla modronosa. Puttas ocriso go dovego santze tapli modronosa, strachans faje doo ge effectov ne puro puchem.",9.868,en,1.000000,,Squacco Heron,4,src/AudioClip/197_Squacco_Heron_299966_1_call.m4a|src/AudioClip/197_Squacco_Heron_299966_2_call.m4a|src/AudioClip/197_Squacco_Heron_299966_3_call.m4a|src/AudioClip/197_Squacco_Heron_299966_4_call_main.m4a,src/AudioClip/197_Squacco_Heron_299966_4_call_main.m4a
198_Savis_Warbler_VO_1 #37153.wav,198,Savis Warbler,1 #37153,"Thank you very much. Thank you very much for watching this video. Please like, share and subscribe. Thank you very much.",12.011,en,1.000000,,Savis Warbler,3,src/AudioClip/198_Savis_Warbler_XC484364_1_call.m4a|src/AudioClip/198_Savis_Warbler_XC484364_2_call_main.m4a|src/AudioClip/198_Savis_Warbler_XC484364_3_call.m4a,src/AudioClip/198_Savis_Warbler_XC484364_2_call_main.m4a
198_Savis_Warbler_VO_1_PL.wav,198,Savis Warbler,1_PL,"Brzentka. Brzentka, pse bivva naiten sti požerot ttitin, ist trudnadov e patrenia, et vatva do zu zu zhenia.",10.437,en,1.000000,,Savis Warbler,3,src/AudioClip/198_Savis_Warbler_XC484364_1_call.m4a|src/AudioClip/198_Savis_Warbler_XC484364_2_call_main.m4a|src/AudioClip/198_Savis_Warbler_XC484364_3_call.m4a,src/AudioClip/198_Savis_Warbler_XC484364_2_call_main.m4a
199_Mute_Swan_VO_1 #27991.wav,199,Mute Swan,1 #27991,Are you ready for Mute Swan? Do you think Mute is ready for Mute Swan? Do you think Mute is ready for Mute Swan?,8.811,en,1.000000,,Mute Swan,4,src/AudioClip/199_Mute_Swan41392_1_call.m4a|src/AudioClip/199_Mute_Swan41392_2_call.m4a|src/AudioClip/199_Mute_Swan41392_4_call_main.m4a|src/AudioClip/199_Mute_Swan_41392_3_call.m4a,src/AudioClip/199_Mute_Swan41392_4_call_main.m4a
199_Mute_Swan_VO_1_PL.wav,199,Mute Swan,1_PL,Wabentnieme. Wabentnieme is a,9.300,en,1.000000,,Mute Swan,4,src/AudioClip/199_Mute_Swan41392_1_call.m4a|src/AudioClip/199_Mute_Swan41392_2_call.m4a|src/AudioClip/199_Mute_Swan41392_4_call_main.m4a|src/AudioClip/199_Mute_Swan_41392_3_call.m4a,src/AudioClip/199_Mute_Swan41392_4_call_main.m4a
19_Mountain_Chickadee_VO_1 #27750.wav,19,Mountain Chickadee,1 #27750,Bae mei bae mei shan shu hai. Bae mei bae mei shan shu hai ruo ji shi sa hai bae mei shi buo da jen ya ling jong.,7.538,en,1.000000,,Mountain Chickadee,4,src/AudioClip/19_Mountain_Chickadee_48855_1_song.m4a|src/AudioClip/19_Mountain_Chickadee_48855_2_song.m4a|src/AudioClip/19_Mountain_Chickadee_48855_3_call.m4a|src/AudioClip/19_Mountain_Chickadee_48855_4_call_main.m4a,src/AudioClip/19_Mountain_Chickadee_48855_4_call_main.m4a
19_Mountain_Chickadee_VO_1_PL.wav,19,Mountain Chickadee,1_PL,"Chickara Gurska. Chickara Gurska is a young woman who lives in Alaska, the hot next stand of OSM.",7.871,en,1.000000,,Mountain Chickadee,4,src/AudioClip/19_Mountain_Chickadee_48855_1_song.m4a|src/AudioClip/19_Mountain_Chickadee_48855_2_song.m4a|src/AudioClip/19_Mountain_Chickadee_48855_3_call.m4a|src/AudioClip/19_Mountain_Chickadee_48855_4_call_main.m4a,src/AudioClip/19_Mountain_Chickadee_48855_4_call_main.m4a
1_Wild_Turkey_VO_1_PL.wav,1,Wild Turkey,1_PL,Index of the time. Index of the time between the two countries of America and the United States of America.,9.247,en,1.000000,,Wild Turkey,3,src/AudioClip/1_Wild_Turkey_129251_1_call.m4a|src/AudioClip/1_Wild_Turkey_129251_2_call.m4a|src/AudioClip/1_Wild_Turkey_129251_3_call_main.m4a,src/AudioClip/1_Wild_Turkey_129251_3_call_main.m4a
200_Grey_Heron_VO_1 #21682.wav,200,Grey Heron,1 #21682,"Hello, I am My name is Luokun Lai. I am from China.",6.208,en,1.000000,,Grey Heron,4,src/AudioClip/200_Grey_Heron_2026_1_call.m4a|src/AudioClip/200_Grey_Heron_2026_2_call.m4a|src/AudioClip/200_Grey_Heron_2026_3_call.m4a|src/AudioClip/200_Grey_Heron_2026_4_call_main.m4a,src/AudioClip/200_Grey_Heron_2026_4_call_main.m4a
200_Grey_Heron_VO_1_PL.wav,200,Grey Heron,1_PL,"T'apla shiva. T'apla s'ta go gat un kus'on na prav de d'urja, mayo aj jirit na s'ti krangov s'inek.",8.089,en,1.000000,,Grey Heron,4,src/AudioClip/200_Grey_Heron_2026_1_call.m4a|src/AudioClip/200_Grey_Heron_2026_2_call.m4a|src/AudioClip/200_Grey_Heron_2026_3_call.m4a|src/AudioClip/200_Grey_Heron_2026_4_call_main.m4a,src/AudioClip/200_Grey_Heron_2026_4_call_main.m4a
201_Common_Cuckoo_VO_1 #10824.wav,201,Common Cuckoo,1 #10824,"Hello, friends! I hope you enjoyed this video. If you want to learn more about Common Cuckoo, please subscribe to our channel.",8.214,en,1.000000,,Common Cuckoo 281235Xc,3,src/AudioClip/201_Common_Cuckoo_281235XC_1_call.m4a|src/AudioClip/201_Common_Cuckoo_281235XC_2_call.m4a|src/AudioClip/201_Common_Cuckoo_281235XC_3_call_main.m4a,src/AudioClip/201_Common_Cuckoo_281235XC_3_call_main.m4a
201_Common_Cuckoo_VO_1_PL.wav,201,Common Cuckoo,1_PL,Cuckoo is a bird. Cuckoo is a bird. It's a bird with a lot of hair and a lot of hair. It's a bird with a lot of color and a lot of hair and a lot of hair.,13.177,en,1.000000,,Common Cuckoo 281235Xc,3,src/AudioClip/201_Common_Cuckoo_281235XC_1_call.m4a|src/AudioClip/201_Common_Cuckoo_281235XC_2_call.m4a|src/AudioClip/201_Common_Cuckoo_281235XC_3_call_main.m4a,src/AudioClip/201_Common_Cuckoo_281235XC_3_call_main.m4a
202_Dunnock_VO_1 #14217.wav,202,Dunnock,1 #14217,"Lin yan liu. Lin yan liu dai yu wo chu nea, jing tai yu yu wo putong de fu jin.",6.375,en,1.000000,,Dunnock,4,src/AudioClip/202_Dunnock_136077_1_call.m4a|src/AudioClip/202_Dunnock_136077_2_call.m4a|src/AudioClip/202_Dunnock_136077_3_call.m4a|src/AudioClip/202_Dunnock_136077_4_call_main.m4a,src/AudioClip/202_Dunnock_136077_4_call_main.m4a
202_Dunnock_VO_1_PL.wav,202,Dunnock,1_PL,"Do you know how to make a hat box? If you want to make a hat box, you can go to Vietnam. That's why I'm here today.",9.404,en,1.000000,,Dunnock,4,src/AudioClip/202_Dunnock_136077_1_call.m4a|src/AudioClip/202_Dunnock_136077_2_call.m4a|src/AudioClip/202_Dunnock_136077_3_call.m4a|src/AudioClip/202_Dunnock_136077_4_call_main.m4a,src/AudioClip/202_Dunnock_136077_4_call_main.m4a
203_Black_Redstart_VO_1 #5112.wav,203,Black Redstart,1 #5112,"Hello, my name is Wang Ben. I am from Shenzhen. My name is Wang Ben. I am from Shenzhen. I am from Shenzhen.",9.575,en,1.000000,,Black Redstart,4,src/AudioClip/203_Black_Redstart_242909_1_call.m4a|src/AudioClip/203_Black_Redstart_242909_2_call.m4a|src/AudioClip/203_Black_Redstart_242909_3_call.m4a|src/AudioClip/203_Black_Redstart_242909_4_call_main.m4a,src/AudioClip/203_Black_Redstart_242909_4_call_main.m4a
203_Black_Redstart_VO_1_PL.wav,203,Black Redstart,1_PL,What do you think about it? Let us know in the comments below and let us know what you think about it.,10.292,en,1.000000,,Black Redstart,4,src/AudioClip/203_Black_Redstart_242909_1_call.m4a|src/AudioClip/203_Black_Redstart_242909_2_call.m4a|src/AudioClip/203_Black_Redstart_242909_3_call.m4a|src/AudioClip/203_Black_Redstart_242909_4_call_main.m4a,src/AudioClip/203_Black_Redstart_242909_4_call_main.m4a
204_Lesser_Whitethroat_VO_1 #25095.wav,204,Lesser Whitethroat,1 #25095,"Bye, Ho Lin Ying. Zhe Zhong Niang, Da La Ting Shu Ming, Ise Shie, Lin Di Jing Lin.",6.256,en,1.000000,,Lesser Whitethroat,4,src/AudioClip/204_Lesser_Whitethroat_36206_1_call.m4a|src/AudioClip/204_Lesser_Whitethroat_36206_2_call.m4a|src/AudioClip/204_Lesser_Whitethroat_36206_3_call.m4a|src/AudioClip/204_Lesser_Whitethroat_36206_4_call_main.m4a,src/AudioClip/204_Lesser_Whitethroat_36206_4_call_main.m4a
204_Lesser_Whitethroat_VO_1_PL.wav,204,Lesser Whitethroat,1_PL,"Pyegra, wachinska nazvarudayu sylvya pokhoji oud wachinski gurztrovnika sylva kture oznata lessne gudushka.",9.213,en,1.000000,,Lesser Whitethroat,4,src/AudioClip/204_Lesser_Whitethroat_36206_1_call.m4a|src/AudioClip/204_Lesser_Whitethroat_36206_2_call.m4a|src/AudioClip/204_Lesser_Whitethroat_36206_3_call.m4a|src/AudioClip/204_Lesser_Whitethroat_36206_4_call_main.m4a,src/AudioClip/204_Lesser_Whitethroat_36206_4_call_main.m4a
205_Common_Goldeneye_VO_1 #10893.wav,205,Common Goldeneye,1 #10893,你一院? 你们堀你為順? 你们堀以就們们堀以樣嗎? 你们堀以樣嗎? 你们為順? 你们堀以樣做們以樣們以樣做? 你们堀以樣做? 你以樣做樣做?,9.575,en,1.000000,,Common Goldeneye,3,src/AudioClip/205_Common_Goldeneye_XC621981_1_call.m4a|src/AudioClip/205_Common_Goldeneye_XC621981_2_call.m4a|src/AudioClip/205_Common_Goldeneye_XC621981_3_call.m4a,
205_Common_Goldeneye_VO_1_PL.wav,205,Common Goldeneye,1_PL,"Gonggou. Gonggou is not a Japanese name, it is a natural language, and it is not a Japanese language.",8.835,en,1.000000,,Common Goldeneye,3,src/AudioClip/205_Common_Goldeneye_XC621981_1_call.m4a|src/AudioClip/205_Common_Goldeneye_XC621981_2_call.m4a|src/AudioClip/205_Common_Goldeneye_XC621981_3_call.m4a,
206_Red_legged_Partridge_VO_1 #33715.wav,206,Red legged Partridge,1 #33715,"Huh, hong tui shi qi? Shi qi zi di mie shang zhu chang. Tamatong chang bok we qi xi xi zai li shu shang. Jie he shun dasong ge shu de bu yi yang.",10.507,en,1.000000,,Red Legged Partridge,3,src/AudioClip/206_Red_legged_Partridge_270380_1_call_main.m4a|src/AudioClip/206_Red_legged_Partridge_270380_2_call.m4a|src/AudioClip/206_Red_legged_Partridge_270380_3_call.m4a,src/AudioClip/206_Red_legged_Partridge_270380_1_call_main.m4a
206_Red_legged_Partridge_VO_1_PL.wav,206,Red legged Partridge,1_PL,Kuropat Vatervona. Kuropat Veyon Vnyazdanajemi and Ratoy Nyanotsuyo Nagawa Njakdrev.,8.115,en,1.000000,,Red Legged Partridge,3,src/AudioClip/206_Red_legged_Partridge_270380_1_call_main.m4a|src/AudioClip/206_Red_legged_Partridge_270380_2_call.m4a|src/AudioClip/206_Red_legged_Partridge_270380_3_call.m4a,src/AudioClip/206_Red_legged_Partridge_270380_1_call_main.m4a
207_Theklas_Lark_VO_1 #40939.wav,207,Theklas Lark,1 #40939,"Hello, I am Feng Tou Ba Lin. Today I am going to show you how to use the Lark Lark Lark Lark Lark Lark.",9.981,en,1.000000,,Theklas Lark,4,src/AudioClip/207_Theklas_Lark_300300_1_call.m4a|src/AudioClip/207_Theklas_Lark_300300_2_call.m4a|src/AudioClip/207_Theklas_Lark_300300_3_call.m4a|src/AudioClip/207_Theklas_Lark_300300_4_call_main.m4a,src/AudioClip/207_Theklas_Lark_300300_4_call_main.m4a
