card_no,bird_name,bird_name_ko,tts_text,voice_tag,review_status,source_file_name,source_vo_id,source_transcript,source_score
1,Wild Turkey,들칠면조,들칠면조입니다. 유럽인이 오기 전부터 사람 곁에 길들여졌습니다. 오래된 식탁의 역사 속에서 이미 주연이던 새입니다.,Jean,draft,1_Wild_Turkey_VO_3.wav,3,Wild Turkey. Wild turkeys were domesticated in the Americas before European contact.,75
2,Hooded Warbler,두건워블러,두건워블러입니다. 숲의 낮은 층을 무대 삼아 땅 가까이에 둥지를 짓습니다. 키 작은 관객만 볼 수 있는 숲속 비밀 공연입니다.,Jean,draft,2_Hooded_Warbler_VO_1.wav,1,Hooded Warbler. This bird spends its time in the understory and nests within a few feet of the ground.,75
3,Prothonotary Warbler,프로토노터리워블러,프로토노터리워블러입니다. 이름은 노란 두건을 쓴 옛 필경사들에게서 왔습니다. 새 한 마리 안에 작은 수도원 이야기가 숨어 있습니다.,Jean,draft,3_Prothonotary_Warbler_VO_1.wav,1,Prothonotary Warbler. The name Prothonotary comes from Catholic scribes who wore yellow hoods.,75
4,Trumpeter Swan,나팔고니,나팔고니입니다. 북아메리카에서 가장 묵직한 새 중 하나입니다. 물 위를 미끄러질 때도 존재감은 작은 배 한 척 같습니다.,Jean,draft,4_Trumpeter_Swan_VO_1.wav,1,"Trumpeter Swan. Weighing over 20 pounds, Trumpeter Swans are the heaviest bird in North America.",75
5,Blue Winged Warbler,푸른날개워블러,푸른날개워블러입니다. 숲과 들판이 만나는 가장자리를 좋아합니다. 두 세계 사이를 오가는 작은 경계의 가수입니다.,Jean,draft,5_blue_winged_warbler_VO_1.wav,1,Blue-winged warbler. This warbler especially likes to nest on the edges between forest and fields.,60
6,American Woodcock,아메리카멧도요,아메리카멧도요입니다. 구애 비행 때는 하늘 높이 올랐다가 수직으로 떨어집니다. 사랑 고백을 롤러코스터처럼 하는 새입니다.,Jean,draft,6_American_Woodcock_VO_1.wav,1,American Woodcock. The Woodcock's amazing mating display involves repeated dives from 300 feet.,75
7,Loggerhead Shrike,큰머리때까치,큰머리때까치입니다. 먹이를 가시에 꽂아 두었다가 나중에 먹습니다. 작은 몸집에 사냥꾼의 식료품 저장고를 갖춘 셈입니다.,Jean,draft,7_Loggerhead_Shrike_VO_2.wav,2,Loggerhead Shrike. Shrikes impale their prey on thorns or barbed wire and may save them for later.,75
8,American Avocet,아메리카장다리물떼새,아메리카장다리물떼새입니다. 자기 둥지도 짓지만 남의 둥지에 알을 맡기기도 합니다. 육아 전략이 꽤 대담한 편입니다.,Jean,draft,8_American_Avocet_VO_2.wav,2,"American Avocet. American Avocets build their own nests, but also parasitize other birds' nests.",75
9,Brown Headed Cowbird,갈색머리찌르레기,갈색머리찌르레기입니다. 둥지를 짓지 않고 다른 새의 둥지에 알을 맡깁니다. 자연의 탁아소를 아주 적극적으로 이용합니다.,Jean,draft,9_Brown_Headed_Cowbird_VO_1.wav,1,Brown Headed Cowbird. Cowbirds do not make nests. They lay their eggs in other birds' nests.,75
10,Yellow Billed Cuckoo,노란부리뻐꾸기,노란부리뻐꾸기입니다. 둥지를 짓는 방식에 이 새만의 꾀가 숨어 있습니다. 작은 집 하나에도 생존 전략이 들어갑니다.,Jean,draft,10_Yellow_Billed_Cuckoo_VO_1.wav,1,Yellow Billed Cuckoo's lay their eggs in other birds' nests when food is abundant.,75
11,Bronzed Cowbird,청동찌르레기,"청동찌르레기입니다. 남의 둥지에 알을 놓고, 때로는 주인 새의 알까지 밀어냅니다. 조용하지만 꽤 거친 둥지 정치입니다.",Jean,draft,11_Bronzed_Cowbird_VO_1.wav,1,Bronzed cowbird. Cowbirds lay eggs in other birds nests and often break or push out the host bird's eggs.,75
12,Barrows Goldeneye,배로흰죽지오리,배로흰죽지오리입니다. 나무 구멍에 둥지 트는 오리라면 누구의 집이든 알을 맡길 수 있습니다. 둥지 공유가 꽤 자유분방합니다.,Jean,draft,12_barrows_goldeneye_VO_3.wav,3,Barrows goldeneye. These ducks will lay their eggs in the nest of any cavity nesting duck.,75
13,Eastern Kingbird,동부킹버드,동부킹버드입니다. 영역을 지킬 때 주황색 왕관을 드러냅니다. 작은 몸으로도 왕처럼 선을 긋는 새입니다.,Jean,draft,13_Eastern_Kingbird_VO_3.wav,3,Eastern Kingbird. The Kingbird displays its orange crown while defending its territory.,75
14,Belted Kingfisher,띠물총새,"띠물총새입니다. 강둑 속으로 긴 굴을 파고, 물이 빠지도록 비스듬히 설계합니다. 물총새의 집은 꽤 영리한 지하 건축입니다.",Jean,draft,14_Belted_Kingfisher_VO_1.wav,1,Belted Kingfisher. The Kingfisher burrow can go up to six feet into a riverbank and slopes to shed water.,75
15,Turkey Vulture,칠면조독수리,"칠면조독수리입니다. 위험하면 토사물을 발사해 자신을 지킵니다. 품위는 잠시 접어 두고, 효과는 확실한 방어술입니다.",Jean,draft,15_Turkey_Vulture_VO_1.wav,1,Turkey Vulture. Turkey vultures can projectile vomit to defend themselves.,75
16,Black Billed Magpie,검은부리까치,검은부리까치입니다. 알도 훔치고 사체도 먹는 잡식가입니다. 숲속의 해결사이자 약간 뻔뻔한 청소부입니다.,Jean,draft,16_Black_Billed_Magpie_VO_1.wav,1,Black Billed Magpie. These omnivores steal eggs and eat carrion along with the diversity of other foods.,75
17,Black Vulture,검은독수리,검은독수리입니다. 냄새를 잘 맡는 이웃을 따라가 먹이를 찾습니다. 사냥보다 정보력이 앞서는 순간입니다.,Jean,draft,17_Black_Vulture_VO_2.wav,2,"Black Vulture. Turkey vultures have a better sense of smell, so Black Vultures follow them to food.",75
18,Horned Lark,뿔종다리,뿔종다리입니다. 큰 유랑 무리를 이루어 다른 새들과 섞입니다. 하늘 위를 떠도는 이동 축제 같습니다.,Jean,draft,18_Horned_Lark_VO_2.wav,2,"Horned Lark. Horned larks form large nomadic flocks, mixing with other bird species.",75
19,Mountain Chickadee,산박새,산박새입니다. 침엽수 숲을 주 무대로 삼습니다. 바늘잎 사이를 오가며 산의 작은 소식을 전합니다.,Jean,draft,19_Mountain_Chickadee_VO_1.wav,1,Mountain chickadee. Mountain chickadees are generally found in the conifer forests of the American West.,75
20,White Breasted Nuthatch,흰가슴동고비,"흰가슴동고비입니다. 먹이를 숨겨 두는 솜씨가 뛰어납니다. 계절이 바뀌기 전, 숲속 곳간을 차근차근 채웁니다.",Jean,draft,20_White_Breasted_Nuthatch_VO_2.wav,2,White Breasted Nuthatch. Nuthatch is cachet seeds for winter in the bark of a tree.,75
21,Carolina Chickadee,캐롤라이나박새,캐롤라이나박새입니다. 씨앗을 수천 곳에 숨기고 기억합니다. 작은 머릿속에 겨울용 지도가 빼곡히 들어 있습니다.,Jean,draft,21_Carolina_Chickadee_VO_1.wav,1,Carolina Chickadee. Chickadees hide seeds and can remember thousands of hiding places.,75
22,Red Breasted Nuthatch,붉은가슴동고비,붉은가슴동고비입니다. 둥지 입구에 끈적한 수지를 발라 침입자를 막습니다. 새가 만든 천연 보안문입니다.,Jean,draft,22_Red_Breasted_Nuthatch_VO_2.wav,2,Red Breasted Nuthatch. These birds put resin around their nest opening to keep out attackers.,75
23,Juniper Titmouse,향나무박새,향나무박새입니다. 겨울을 나려고 씨앗을 부지런히 저장합니다. 작은 창고지기처럼 계절을 준비합니다.,Jean,draft,23_Juniper_Titmouse_VO_2.wav,2,Juniper Titmouse. These little birds make it through winter by storing seeds.,75
24,Blue Jay,푸른어치,"푸른어치입니다. 도토리를 한 번에 여러 개 물고, 겨울을 위해 수백 개를 숨깁니다. 푸른 깃털의 저축왕입니다.",Jean,draft,24_Blue_Jay_VO_2.wav,2,Blue Jay. Blue Jays can carry up to five acorns and will store hundreds for winter.,75
25,Stellers Jay,스텔러어치,스텔러어치입니다. 영리하고 적응력이 뛰어나며 다양한 먹이를 활용하는 새입니다.,Jean,draft,25_stellers_jay_VO_1.wav,1,Stellers jay. Naturalist Jorg Steller saw this bird on a Russian exploration to Alaska in 1741.,75
26,Clarks Nutcracker,클라크잣까마귀,클라크잣까마귀입니다. 영리하고 적응력이 뛰어나며 다양한 먹이를 활용하는 새입니다.,Jean,draft,26_Clarks_Nutcracker_VO_1.wav,1,Clarks Nutcracker. These birds are omnivorous but cash thousands of pine seeds for the winter.,75
27,Red Headed Woodpecker,붉은머리딱따구리,"붉은머리딱따구리입니다. 먹이를 숨겨 두는 솜씨가 뛰어납니다. 계절이 바뀌기 전, 숲속 곳간을 차근차근 채웁니다.",Jean,draft,27_Red_Headed_Woodpecker_VO_2.wav,2,"Red Headed Woodpecker. These woodpeckers store nuts, seeds, and insects in wood or under bark.",75
28,Acorn Woodpecker,도토리딱따구리,도토리딱따구리입니다. 죽은 나무 하나에 도토리 창고를 수만 칸이나 뚫을 수 있습니다. 숲속의 거대한 식량 금고입니다.,Jean,draft,28_Acorn_Woodpecker_VO_1.wav,1,"Acorn Woodpecker. In a single dead tree, these birds may drill as many as 50,000 holes for storing acorns.",75
29,Red Bellied Woodpecker,붉은배딱따구리,붉은배딱따구리입니다. 작은 곤충을 놓치지 않는 눈썰미가 있습니다. 숲속의 미세한 움직임도 먹잇감이 됩니다.,Jean,draft,29_Red_Bellied_Woodpecker_VO_2.wav,2,"Red-bellied Woodpecker. These birds' tongues reach out two inches for insects, but seeds are half their diet.",60
30,Northern Shoveler,북부넓적부리,북부넓적부리입니다. 넓은 부리로 물을 체처럼 걸러 작은 먹이를 찾아냅니다. 부리가 곧 휴대용 여과기입니다.,Jean,draft,30_Northern_Shoveler_VO_2.wav,2,Northern Shoveler. The shoveler's large bill strains invertebrates from the water.,75
31,Spotted Sandpiper,점박이도요새,점박이도요새입니다. 꼬리를 끊임없이 까딱입니다. 물가의 작은 시계추처럼 존재감을 알립니다.,Jean,draft,31_Spotted_Sandpiper_VO_2.wav,2,Spotted Sandpiper. These sandpipers constantly bob their tails. People call them teeter peeps and tiptails.,75
32,Purple Gallinule,보라물닭,보라물닭입니다. 긴 발가락 덕분에 수련잎 위도 가라앉지 않고 걸어갑니다. 연못 위를 걷는 줄타기 선수입니다.,Jean,draft,32_Purple_Gallinule_VO_1.wav,1,"Purple Gallinule. With its long toes, this bird can walk on lily pads without sinking.",75
33,Wilsons Snipe,윌슨꺅도요,윌슨꺅도요입니다. 해안과 습지 가장자리에서 긴 부리로 작은 먹이를 찾아냅니다.,Jean,draft,33_wilsons_snipe_VO_1.wav,1,"wilsons snipe. Due to the position of their eyes, wilsons snipes can see predators approaching from the front and back.",75
34,Common Loon,일반아비,일반아비입니다. 서식지에 맞게 독특한 먹이 활동과 행동을 보여 주는 새입니다.,Jean,draft,34_Common_Loon_VO_3.wav,3,Common Loon. Loon chicks spend the majority of their first week of life writing on a parent's back.,75
35,American Bittern,아메리카해오라기,아메리카해오라기입니다. 깃털과 자세가 훌륭한 위장복이 됩니다. 눈앞에 있어도 풍경인 척 숨어 버립니다.,Jean,draft,35_american_bittern_VO_3.wav,3,American bittern. Bitterns hide in reeds and cattails or they are well camouflaged.,75
36,Eastern Phoebe,동부피비새,동부피비새입니다. 둥지를 짓는 방식에 이 새만의 꾀가 숨어 있습니다. 작은 집 하나에도 생존 전략이 들어갑니다.,Jean,draft,36_Eastern_Phoebe_VO_2.wav,2,"Eastern Phoebe. Phoebe's use mud to attach nests to riverbanks, rocky outcrops, or human structures.",75
37,Scissor Tailed Flycatcher,가위꼬리딱새,가위꼬리딱새입니다. 구애 행동은 작은 무대 공연 같습니다. 날개와 깃털로 마음을 전하는 방식이 인상적입니다.,Jean,draft,37_Scissor_Tailed_Flycatcher_VO_1.wav,1,Scissor Tailed Flycatcher. The mating display of these birds involves aerial acrobatics that show off the long tail.,75
38,Osprey,물수리,물수리입니다. 먹이를 노릴 때는 물이나 공기 속으로 과감히 뛰어듭니다. 망설임보다 속도가 먼저입니다.,Jean,draft,38_Osprey_VO_1.wav,1,"Ospreys are excellent hunters, catching a fish in at least one out of every four dives.",75
39,Ruby Throated Hummingbird,루비목벌새,루비목벌새입니다. 작은 곤충을 놓치지 않는 눈썰미가 있습니다. 숲속의 미세한 움직임도 먹잇감이 됩니다.,Jean,draft,39_ruby_throated_hummingbird_VO_3.wav,3,"Ruby throated hummingbird. Hummingbirds feed on nectar, but they also eat many small insects.",75
40,Annas Hummingbird,안나벌새,안나벌새입니다. 구애 행동은 작은 무대 공연 같습니다. 날개와 깃털로 마음을 전하는 방식이 인상적입니다.,Jean,draft,40_Annas_Hummingbird_VO_2.wav,2,Annas Hummingbird. These birds' impressive mating displays involve diving from over 100 feet in the air.,75
41,Great Crested Flycatcher,큰볏딱새,큰볏딱새입니다. 작은 곤충을 놓치지 않는 눈썰미가 있습니다. 숲속의 미세한 움직임도 먹잇감이 됩니다.,Jean,draft,41_great_crested_flycatcher_VO_3.wav,3,Great crested flycatcher. These birds avoid competition by focusing on insects high up in trees.,75
42,Blue Gray Gnatcatcher,푸른회색모기잡이새,푸른회색모기잡이새입니다. 구애 행동은 작은 무대 공연 같습니다. 날개와 깃털로 마음을 전하는 방식이 인상적입니다.,Jean,draft,42_Blue_Gray_Gnatcatcher_VO_3.wav,3,Blue Gray Gnatcatcher. Gnatcatcher's breeding range is steadily shifting north with climate change.,75
43,Hermit Thrush,은둔지빠귀,은둔지빠귀입니다. 둥지를 낮은 곳에 숨겨 새끼를 키웁니다. 땅 가까운 곳에 작은 비밀방을 마련하는 셈입니다.,Jean,draft,43_Hermit_Thrush_VO_1.wav,1,Hermit Thrush. Hermit thrushes tend to nest on the ground in the western U.S. and in trees in the east.,75
44,Killdeer,킬디어새,킬디어새입니다. 다친 척 날개를 끌며 포식자를 둥지에서 멀리 유인합니다. 연기력까지 갖춘 부모 새입니다.,Jean,draft,44_Killdeer_VO_1.wav,1,Killdeer. Killdeers will fake a broken wing to lure predators from their nests.,75
45,Franklins Gull,프랭클린갈매기,프랭클린갈매기입니다. 둥지를 짓는 방식에 이 새만의 꾀가 숨어 있습니다. 작은 집 하나에도 생존 전략이 들어갑니다.,Jean,draft,45_Franklins_Gull_VO_1.wav,1,Franklin's Gull. These gulls make floating nests of plant material on prairie marshes.,60
46,Mallard,청둥오리,청둥오리입니다. 물가에서 생활하며 헤엄과 잠수를 활용해 먹이를 찾습니다.,Jean,draft,46_Mallard_VO_3.wav,3,Mallards are among the most abundant ducks in the world.,75
47,Forsters Tern,포스터제비갈매기,포스터제비갈매기입니다. 둥지를 낮은 곳에 숨겨 새끼를 키웁니다. 땅 가까운 곳에 작은 비밀방을 마련하는 셈입니다.,Jean,draft,47_Forsters_Tern_VO_1.wav,1,Forsters Tern. These birds nest on the ground on a raft of floating vegetation or on muskret lodges.,75
48,Black Tern,검은제비갈매기,검은제비갈매기입니다. 둥지를 짓는 방식에 이 새만의 꾀가 숨어 있습니다. 작은 집 하나에도 생존 전략이 들어갑니다.,Jean,draft,48_Black_Ternr_VO_1.wav,1,Black Tern. These terns build floating nests out of marsh plants.,60
49,Clarks Grebe,클라크논병아리,클라크논병아리입니다. 서식지에 맞게 독특한 먹이 활동과 행동을 보여 주는 새입니다.,Jean,draft,49_Clarks_Grebe_VO_1.wav,1,Clarks Grebe. Clark was a 19th century surveyor who collected specimens for the Smithsonian.,75
50,Wood Duck,숲오리,숲오리입니다. 나무 구멍과 틈을 살려 둥지를 마련합니다. 숲의 빈방을 알뜰하게 고르는 건축가입니다.,Jean,draft,50_Wood_Duck_VO_3.wav,3,Wood Duck. Wood ducks nest in tree cavities and wooded areas.,75
51,Ruddy Duck,붉은빛오리,붉은빛오리입니다. 구애 행동은 작은 무대 공연 같습니다. 날개와 깃털로 마음을 전하는 방식이 인상적입니다.,Jean,draft,51_Ruddy_Duck_VO_1.wav,1,"Ruddy Duck. To display for mates, males slap their blue bills on their chests and run across the water.",75
52,Common Yellowthroat,일반노란목솔새,일반노란목솔새입니다. 서식지에 맞게 독특한 먹이 활동과 행동을 보여 주는 새입니다.,Jean,draft,52_Common_Yellowthroat_VO_3.wav,3,Common Yellowthroat. This was one of the first American birds to be cataloged by Linnaeus in 1766.,75
53,Pied Billed Grebe,얼룩부리논병아리,얼룩부리논병아리입니다. 물풀을 엮어 물 위에 작은 뗏목 둥지를 띄웁니다. 알들은 그 위에서 흔들리는 비밀 기지처럼 자랍니다.,Jean,draft,53_Pied_Billed_Grebe_VO_1.wav,1,Pied Billed Grebe. Pied Billed Grebes create a floating platform nest with plant material.,75
54,Pileated Woodpecker,도가머리딱따구리,"도가머리딱따구리입니다. 낡은 둥지는 이웃 새들의 빈집이 되고, 먹이를 찾던 자리는 곤충 뷔페가 됩니다.",Jean,draft,54_pileated_woodpecker_VO_1.wav,1,Other birds use these birds' old nests and gleam bugs where they've been feeding.,60
55,Western Meadowlark,서부종다리,"서부종다리입니다. 노래가 플루트처럼 맑아서, 초원 한복판에 작은 연주회가 열린 듯합니다.",Jean,draft,55_Western_Meadowlark_VO_1.wav,1,Western Meadowlark. This pretty bird also has a beautiful flute-like song.,75
56,Grasshopper Sparrow,메뚜기참새,"메뚜기참새입니다. 울음소리가 메뚜기 소리처럼 숨어 있어, 귀를 기울여야 초원의 작은 연주자를 찾을 수 있습니다.",Jean,draft,56_Grasshopper_Sparrow_VO_1.wav,1,Grasshopper Sparrow. The Grasshopper-like song of these sparrows is often overlooked.,75
57,Chipping Sparrow,칩핑참새,칩핑참새입니다. 트인 땅에서 먹이를 찾다가도 나무 곁을 떠나지 않습니다. 식탁과 피난처를 한눈에 보는 영리한 자리 선정입니다.,Jean,draft,57_Chipping_Sparrow_VO_1.wav,1,Chipping Sparrow. These sparrows generally feed on open ground but near trees.,75
58,Cassins Sparrow,캐신참새,캐신참새입니다. 작은 몸집과 뚜렷한 울음소리로 숲과 초원에서 존재감을 드러냅니다.,Jean,draft,58_Cassins_Sparrow_VO_2.wav,2,Can you see the picture of Cassins Sparrow? Can you see the picture of Cassins Sparrow? Did you see the picture of Cassins Sparrow?,75
59,Bairds Sparrow,베어드참새,베어드참새입니다. 작은 몸집과 뚜렷한 울음소리로 숲과 초원에서 존재감을 드러냅니다.,Jean,draft,59_Bairds_Sparrow_VO_3.wav,3,Bairds Sparrow. Spencer Baird was the first curator of the Smithsonian.,75
60,California Quail,캘리포니아메추라기,캘리포니아메추라기입니다. 둥지를 짓는 방식에 이 새만의 꾀가 숨어 있습니다. 작은 집 하나에도 생존 전략이 들어갑니다.,Jean,draft,60_California_Quail_VO_3.wav,3,California Quail. California quail nests have been reported with as many as 28 eggs.,75
61,Northern Bobwhite,북부보브화이트새,북부보브화이트새입니다. 서식지에 맞게 독특한 먹이 활동과 행동을 보여 주는 새입니다.,Jean,draft,61_Northern_Bobwhite_VO_2.wav,2,"Northern Bobwhite. Bobwhites are prolific breeders, but their numbers are in decline.",75
62,Mourning Dove,애도비둘기,애도비둘기입니다. 부드러운 울음소리와 씨앗을 먹는 습성이 잘 알려진 새입니다.,Jean,draft,62_Mourning_Dove_VO_1.wav,1,Mourning Dove. One pair of doves may raise five or six small broods in a year.,75
63,Baltimore Oriole,볼티모어꾀꼬리,볼티모어꾀꼬리입니다. 나무 구멍과 틈을 살려 둥지를 마련합니다. 숲의 빈방을 알뜰하게 고르는 건축가입니다.,Jean,draft,63_baltimore_oriole_VO_1.wav,1,"Baltimore Oriole, Orioles weave pouch nests that hang from a tree branch.",75
64,Red Crossbill,붉은솔잣새새,붉은솔잣새새입니다. 서식지에 맞게 독특한 먹이 활동과 행동을 보여 주는 새입니다.,Jean,draft,64_Red_Crossbill_VO_3.wav,3,These birds use their specialized bills to pry apart conifer seed cones.,60
65,Lazuli Bunting,라줄리멧새,라줄리멧새입니다. 이름 속에 생김새나 오래된 이야기가 숨어 있습니다. 카드를 볼 때 이름부터 한 번 더 들여다볼 만합니다.,Jean,draft,65_Lazuli_Bunting_VO_2.wav,2,Lazuli Bunting. The Latin name Amina means beautiful or charming.,75
66,American Crow,아메리카까마귀,아메리카까마귀입니다. 알을 둘러싼 전략이 꽤 대담합니다. 조용한 둥지 안에서도 치열한 이야기가 벌어집니다.,Jean,draft,66_American_Crow_VO_1.wav,1,American Crow. These intelligent birds steal eggs and food from other birds and cash food for later.,75
67,Fish Crow,물고기까마귀,물고기까마귀입니다. 물가에서 물고기를 노리는 솜씨가 좋습니다. 잔잔한 수면 아래를 놓치지 않는 사냥꾼입니다.,Jean,draft,67_Fish_Crow_VO_1.wav,1,"Fish Crow. These birds may eat more fish than other crows, but they're actually omnivores.",75
68,Black Crowned Night Heron,검은관밤왜가리,검은관밤왜가리입니다. 알을 둘러싼 전략이 꽤 대담합니다. 조용한 둥지 안에서도 치열한 이야기가 벌어집니다.,Jean,draft,68_black_crowned_night_heron_VO_3.wav,3,"Black crowned night heron. Night herons eat carrion and eggs in addition to fish, rodents, and invertebrates.",75
69,Chihuahuan Raven,치와와큰까마귀,치와와큰까마귀입니다. 영리하고 적응력이 뛰어나며 다양한 먹이를 활용하는 새입니다.,Jean,draft,69_Chihuahuan_Raven_VO_3.wav,3,Chihuahuan Raven. This bird is native to the Chihuahuan Desert of the southwest U.S. and northern Mexico.,75
70,Common Raven,큰까마귀,큰까마귀입니다. 알을 둘러싼 전략이 꽤 대담합니다. 조용한 둥지 안에서도 치열한 이야기가 벌어집니다.,Jean,draft,70_Common_Raven_VO_1.wav,1,"Common Raven. Ravens are omnivores whose diet includes insects, rodents, eggs, birds, and carrion.",75
71,Northern Cardinal,북부홍관조,북부홍관조입니다. 작은 몸집과 뚜렷한 울음소리로 숲과 초원에서 존재감을 드러냅니다.,Jean,draft,71_Northern_Cardinal_VO_2.wav,2,"Northern Cardinal. In most North American species only males sing, but female cardinals break this rule.",75
72,Yellow Bellied Sapsucker,노란배딱따구리,노란배딱따구리입니다. 작은 곤충을 놓치지 않는 눈썰미가 있습니다. 숲속의 미세한 움직임도 먹잇감이 됩니다.,Jean,draft,72_Yellow_Bellied_Sapsucker_VO_1.wav,1,Yellow Bellied Sapsucker. Sapsuckers drill rows of holes in trees then lap up the sap and the insects it attracts.,75
73,Indigo Bunting,남색멧새,남색멧새입니다. 작은 몸집과 뚜렷한 울음소리로 숲과 초원에서 존재감을 드러냅니다.,Jean,draft,73_Indigo_Bunting_VO_1.wav,1,Indigo Buntings are almost always found on forest edges.,75
74,Western Tanager,서부풍금조,서부풍금조입니다. 작은 몸집과 뚜렷한 울음소리로 숲과 초원에서 존재감을 드러냅니다.,Jean,draft,74_Western_Tanager_VO_1.wav,1,Western Tanager. These flame-colored birds are hard to see because they like the canopies of evergreen forests.,75
75,Spotted Towhee,점박이토히,점박이토히입니다. 작은 곤충을 놓치지 않는 눈썰미가 있습니다. 숲속의 미세한 움직임도 먹잇감이 됩니다.,Jean,draft,75_Spotted_Towhee_VO_1.wav,1,Spotted Towhee. These birds forage by hopping backwards to uncover insects and seeds in the leaf litter.,75
76,Rose Breasted Grosbeak,장밋빛가슴콩새,장밋빛가슴콩새입니다. 이름 속에 생김새나 오래된 이야기가 숨어 있습니다. 카드를 볼 때 이름부터 한 번 더 들여다볼 만합니다.,Jean,draft,76_Rose_Breasted_Grosbeak_VO_3.wav,3,This pretty sweet sounding bird has the gruesome nickname Cutthroat.,60
77,Green Heron,초록왜가리,초록왜가리입니다. 물가에서 물고기를 노리는 솜씨가 좋습니다. 잔잔한 수면 아래를 놓치지 않는 사냥꾼입니다.,Jean,draft,77_Green_Heron_VO_1.wav,1,Green Heron. Green herons drop insects and other objects onto the water to attract fish.,75
78,Gray Catbird,회색크아트브어드새,회색크아트브어드새입니다. 울음소리에는 이 새만의 서명이 담겨 있습니다. 숲이나 들판에서 먼저 들리는 작은 소개장입니다.,Jean,draft,78_gray_catbird_VO_1.wav,1,Gray catbird. Catbirds mimic other birds and also have a call that sounds like a cat meowing.,75
79,Northern Mockingbird,북부흉내지빠귀,북부흉내지빠귀입니다. 울음소리에는 이 새만의 서명이 담겨 있습니다. 숲이나 들판에서 먼저 들리는 작은 소개장입니다.,Jean,draft,79_Northern_Mockingbird_VO_3.wav,3,Northern Mockingbird. A male mockingbird may learn around 200 songs throughout its life.,75
80,Hooded Merganser,두건비오리,두건비오리입니다. 둥지를 낮은 곳에 숨겨 새끼를 키웁니다. 땅 가까운 곳에 작은 비밀방을 마련하는 셈입니다.,Jean,draft,80_Hooded_Merganser_VO_1.wav,1,Hooded Merganser. Merganser chicks jump from their cavity nest to the ground when they're just one day old.,75
