card_no,bird_name,bird_name_ko,tts_text,voice_tag,review_status,source_file_name,source_vo_id,source_transcript,source_score
164,Red Eyed Vireo,붉은에이에드비레오,붉은에이에드비레오입니다. 무리를 이루면 풍경이 달라집니다. 한 마리가 아니라 하늘을 움직이는 작은 행렬이 됩니다.,Jean,draft,164_Red_Eyed_Vireo_VO_1.wav,1,Red Eyed Vireo. Near sighted vireos flock with other birds that make noise if predators are around.,75
165,House Wren,집굴뚝새,집굴뚝새입니다. 둥지를 짓는 방식에 이 새만의 꾀가 숨어 있습니다. 작은 집 하나에도 생존 전략이 들어갑니다.,Jean,draft,165_House_Wren_VO_1.wav,1,House Wren. House Wrens will remove the eggs of other birds and take over their nests.,75
166,Savannah Sparrow,사바나참새,사바나참새입니다. 이름 속에 생김새나 오래된 이야기가 숨어 있습니다. 카드를 볼 때 이름부터 한 번 더 들여다볼 만합니다.,Jean,draft,166_Savannah_Sparrow_VO_1.wav,1,Savannah Sparrow. This sparrow is named after both Savannah Georgia and Sandwich Sound Alaska.,75
167,Eastern Bluebird,동부파랑새,동부파랑새입니다. 나무 구멍과 틈을 살려 둥지를 마련합니다. 숲의 빈방을 알뜰하게 고르는 건축가입니다.,Jean,draft,167_Eastern_Bluebird_VO_1.wav,1,Eastern Bluebird. Bluebirds struggle to breed where there is a lack of tree cavities. Nestboxes help.,75
168,Mountain Bluebird,산파랑새,산파랑새입니다. 작은 몸집과 뚜렷한 울음소리로 숲과 초원에서 존재감을 드러냅니다.,Jean,draft,168_mountain_bluebird_VO_2.wav,2,Mountain bluebird. These birds can be found from prairies up to alpine zones above tree line.,75
169,Great Blue Heron,큰푸른왜가리,큰푸른왜가리입니다. 습지와 얕은 물가에서 긴 다리와 부리를 활용해 먹이를 찾습니다.,Jean,draft,169_Great_Blue_Heron_VO_12.wav,12,"Great Blue Heron. Great Blue Herons form rookeries with egrets, cormorants, and other herons.",75
170,Great Egret,대백로,대백로입니다. 습지와 얕은 물가에서 긴 다리와 부리를 활용해 먹이를 찾습니다.,Jean,draft,170_Great_Egret_VO_1.wav,1,Great Egret. Smaller birds will sometimes follow after Great Egrets as they stir up prey.,75
171,Broad Winged Hawk,넓은날개매,넓은날개매입니다. 날카로운 시야와 강한 날개로 하늘을 누비는 맹금류입니다.,Jean,draft,171_Broad_Winged_Hawk_VO_1.wav,1,Broad-winged hawk. This hawk is seen more during migration than while it's in the forest interior.,60
172,American Redstart,아메리카딱새,아메리카딱새입니다. 이름 속에 생김새나 오래된 이야기가 숨어 있습니다. 카드를 볼 때 이름부터 한 번 더 들여다볼 만합니다.,Jean,draft,172_American_Redstart_VO_1.wav,1,"American Redstart. Redstarts get their name from the Old English word stort, meaning tail.",75
173,Canvasback,캔버스백새,캔버스백새입니다. 물가에서 생활하며 헤엄과 잠수를 활용해 먹이를 찾습니다.,Jean,draft,173_Canvasback_VO_1.wav,1,Canvasback. The fastest recorded Canvasback was flying 116 kilometers per hour.,75
174,Vauxs Swift,브오크스스칼새,브오크스스칼새입니다. 하늘을 빠르게 날며 날아다니는 곤충을 잡아먹습니다.,Jean,draft,174_Vauxs_Swift_VO_1.wav,1,Vaux Swift. William Sansom Vaux was a wealthy mineralogist and naturalist.,60
175,Brant,브란트새,브란트새입니다. 서식지에 맞게 독특한 먹이 활동과 행동을 보여 주는 새입니다.,Jean,draft,175_Brant_VO_1.wav,1,"Brant. Brants can migrate the 5,300 kilometers from Alaska to Mexico in 54 hours.",75
176,White Throated Swift,흰목칼새,흰목칼새입니다. 하늘을 빠르게 날며 날아다니는 곤충을 잡아먹습니다.,Jean,draft,176_White_Throated_Swift_VO_1.wav,1,White Throated Swift. The White Throated Swift is one of the fastest birds in North America.,75
177,Scaled Quail,스크아르에드메추라기,스크아르에드메추라기입니다. 주로 땅 위에서 생활하며 풀숲과 덤불 사이를 빠르게 오갑니다.,Jean,draft,177_Scaled_Quail_VO_1.wav,1,Scaled Quail. Quail chicks can get up and follow their parents as soon as they hatch.,75
178,Black Chinned Hummingbird,검은치이느느에드벌새,검은치이느느에드벌새입니다. 구애 행동은 작은 무대 공연 같습니다. 날개와 깃털로 마음을 전하는 방식이 인상적입니다.,Jean,draft,178_Black_Chinned_Hummingbird_VO_1.wav,1,"Black Chinned Hummingbird. To display, males of this species will fly up to 30 meters then dive reaching speeds near 100 kilometers per hour.",75
179,Red Breasted Merganser,붉은가슴비오리,붉은가슴비오리입니다. 물가에서 생활하며 헤엄과 잠수를 활용해 먹이를 찾습니다.,Jean,draft,179_Red_Breasted_Merganser_VO_1.wav,1,"Red Breasted Merganser. A Red Breasted Merganser was recorded flying 160 kilometers an hour, the fastest of any duck.",75
180,Painted Whitestart,채색우이트에스트아르트새,채색우이트에스트아르트새입니다. 작은 곤충을 놓치지 않는 눈썰미가 있습니다. 숲속의 미세한 움직임도 먹잇감이 됩니다.,Jean,draft,180_Painted_Whitestart_VO_1.wav,1,"Painted Whitestart. When they forage, white starts will flick their wings or tails to flush insects.",75
181,Eurasian Magpie,유라시아까치,유라시아까치입니다. 영리하고 적응력이 뛰어나며 다양한 먹이를 활용하는 새입니다.,Jean,draft,181_Eurasian_Magpie_VO_1.wav,1,"Eurasian Magpie. These birds are considered to have very high intelligence, similar to great apes.",75
182,Carrion Crow,크아르르이오느까마귀,크아르르이오느까마귀입니다. 영리하고 적응력이 뛰어나며 다양한 먹이를 활용하는 새입니다.,Jean,draft,182_Carrion_Crow_VO_1.wav,1,"Carrion Crow. In their range, Carrion Crows are the primary scavengers of small animal carcasses.",75
183,Griffon Vulture,그르이프프오느독수리,그르이프프오느독수리입니다. 날카로운 시야와 강한 날개로 하늘을 누비는 맹금류입니다.,Jean,draft,183_Griffon_Vulture_VO_1.wav,1,Griffon Vulture. These birds bald heads help them thermoregulate.,75
184,Coal Tit,크오아르트이트새,"크오아르트이트새입니다. 먹이를 숨겨 두는 솜씨가 뛰어납니다. 계절이 바뀌기 전, 숲속 곳간을 차근차근 채웁니다.",Jean,draft,184_Coal_Tit_VO_1.wav,1,Coal tit. Coal tits store sprue seeds and sometimes invertebrates for winter.,75
185,Eurasian Nuthatch,유라시아동고비,유라시아동고비입니다. 둥지를 짓는 방식에 이 새만의 꾀가 숨어 있습니다. 작은 집 하나에도 생존 전략이 들어갑니다.,Jean,draft,185_Eurasian_Nuthatch_VO_1.wav,1,Eurasian Nuthatch. These birds will often recycle old woodpecker holes as nesting sites.,75
186,Eurasian Nutcracker,유라시아잣까마귀,유라시아잣까마귀입니다. 영리하고 적응력이 뛰어나며 다양한 먹이를 활용하는 새입니다.,Jean,draft,186_Eurasian_Nutcracker_VO_1.wav,1,Eurasian Nutcracker. Nutcrackers have been observed traveling as far as 32 km to cash seeds.,75
187,Red Backed Shrike,붉은브아크에드때까치,붉은브아크에드때까치입니다. 서식지에 맞게 독특한 먹이 활동과 행동을 보여 주는 새입니다.,Jean,draft,187_Red_Backed_Shrike_VO_1.wav,1,Red Backed Shrike. These butcher birds use thorns and barbed wire as food storage.,75
188,Common Kingfisher,물총새,물총새입니다. 물가에서 물고기를 노리는 솜씨가 좋습니다. 잔잔한 수면 아래를 놓치지 않는 사냥꾼입니다.,Jean,draft,188_Common_Kingfisher_VO_1.wav,1,Common Kingfisher. Kingfishers have a third eyelid that protects their eyes while hunting underwater.,75
189,Little Owl,금눈쇠올빼미,"금눈쇠올빼미입니다. 밤에 활동하는 맹금류로, 조용히 날아 먹이를 찾는 습성이 두드러집니다.",Jean,draft,189_Little_Owl_VO_1.wav,1,"Little Owl. This owl accompanied Athena, goddess of wisdom.",75
190,Eurasian Jay,어치,어치입니다. 영리하고 적응력이 뛰어나며 다양한 먹이를 활용하는 새입니다.,Jean,draft,190_Eurasian_Jay_VO_1.wav,1,Eurasian Jay. These birds plan for future needs by hoarding acorns for winter.,75
191,White Stork,황새,황새입니다. 습지와 얕은 물가에서 긴 다리와 부리를 활용해 먹이를 찾습니다.,Jean,draft,191_White_Stork_VO_1.wav,1,White Stork. Storks were symbols of life or family in multiple ancient cultures.,75
192,White Throated Dipper,흰목물까마귀,흰목물까마귀입니다. 이름 속에 생김새나 오래된 이야기가 숨어 있습니다. 카드를 볼 때 이름부터 한 번 더 들여다볼 만합니다.,Jean,draft,192_White_Throated_Dipper_VO_1.wav,1,White Throated Dipper. The Dipper gets its name from the frequent bobbing motion it makes.,75
193,Black Throated Diver,검은목드이브어새,검은목드이브어새입니다. 서식지에 맞게 독특한 먹이 활동과 행동을 보여 주는 새입니다.,Jean,draft,193_Black_Throated_Diver_VO_1.wav,1,Black Throated Diver. This northern species breeds on deep freshwater lakes within a yard of the water's edge.,75
194,Wilsons Storm Petrel,윌슨스트오르므페트럴새,윌슨스트오르므페트럴새입니다. 서식지에 맞게 독특한 먹이 활동과 행동을 보여 주는 새입니다.,Jean,draft,194_Wilsons_Storm_Petrel_VO_1.wav,1,"Wilsons Storm Petrel. This is an abundant species, but most humans will never see one because they live mostly at sea.",75
195,Great Crested Grebe,뿔논병아리,뿔논병아리입니다. 서식지에 맞게 독특한 먹이 활동과 행동을 보여 주는 새입니다.,Jean,draft,195_Great_Crested_Grebe_VO_1.wav,1,Great Crested Grebe. Great Crested Grebe parents will choose their favorite chicks and rear them individually.,75
196,Common Little Bittern,일반작은해오라기,일반작은해오라기입니다. 습지와 얕은 물가에서 긴 다리와 부리를 활용해 먹이를 찾습니다.,Jean,draft,196_Common_Little_Bittern_VO_1.wav,1,"Common Little Bittern. At just 38 centimeters tall, this is one of the smallest herons.",75
197,Squacco Heron,스쿠아크크오왜가리,스쿠아크크오왜가리입니다. 구애 행동은 작은 무대 공연 같습니다. 날개와 깃털로 마음을 전하는 방식이 인상적입니다.,Jean,draft,197_Squacco_Heron_VO_1.wav,1,"Squacco Heron. In mating displays, male Squacco Herons erect their long showy plume feathers.",75
198,Savis Warbler,스아브이스워블러,스아브이스워블러입니다. 울음소리에는 이 새만의 서명이 담겨 있습니다. 숲이나 들판에서 먼저 들리는 작은 소개장입니다.,Jean,draft,198_Savis_Warbler_VO_1.wav,1,"Paolo Savi is called the father of Italian geology, but he was also an ornithologist.",60
199,Mute Swan,므우트에고니,므우트에고니입니다. 이름 속에 생김새나 오래된 이야기가 숨어 있습니다. 카드를 볼 때 이름부터 한 번 더 들여다볼 만합니다.,Jean,draft,199_Mute_Swan_VO_1.wav,1,Mute Swan. The Mute Swan earned its name because it is less vocal than other species.,75
200,Grey Heron,왜가리,왜가리입니다. 습지와 얕은 물가에서 긴 다리와 부리를 활용해 먹이를 찾습니다.,Jean,draft,200_Grey_Heron_VO_1.wav,1,Grey Heron. These large herons have 19 vertebrae in their necks.,75
201,Common Cuckoo 281235Xc,일반뻐꾸기,일반뻐꾸기입니다. 알을 둘러싼 전략이 꽤 대담합니다. 조용한 둥지 안에서도 치열한 이야기가 벌어집니다.,Jean,draft,201_Common_Cuckoo_VO_1.wav,1,Common Cuckoo. These brood parasites eggs can match host species eggs in color and pattern.,75
202,Dunnock,드우느느오크새,드우느느오크새입니다. 둥지를 짓는 방식에 이 새만의 꾀가 숨어 있습니다. 작은 집 하나에도 생존 전략이 들어갑니다.,Jean,draft,202_Dunnock_VO_1.wav,1,Dunnock. The chicks in a single nest of Dunnocks often have different fathers.,75
203,Black Redstart,검은딱새,검은딱새입니다. 서식지에 맞게 독특한 먹이 활동과 행동을 보여 주는 새입니다.,Jean,draft,203_Black_Redstart_VO_1.wav,1,"Black Redstart, native to mountains, this bird moved into bombed areas following World War II.",75
204,Lesser Whitethroat,작은우이트에스러오아트새,작은우이트에스러오아트새입니다. 이름 속에 생김새나 오래된 이야기가 숨어 있습니다. 카드를 볼 때 이름부터 한 번 더 들여다볼 만합니다.,Jean,draft,204_Lesser_Whitethroat_VO_1.wav,1,Lesser Whitethroat. The genus name Silvia means Woodland sprite.,75
205,Common Goldeneye,일반흰죽지오리,일반흰죽지오리입니다. 둥지를 짓는 방식에 이 새만의 꾀가 숨어 있습니다. 작은 집 하나에도 생존 전략이 들어갑니다.,Jean,draft,205_Common_Goldeneye_VO_1.wav,1,Common Goldeneye. Golden eyes do not excavate nest holes. They look for natural cavities or old woodpecker nests.,75
206,Red Legged Partridge,붉은르에그그에드프아르트르이드그에새,붉은르에그그에드프아르트르이드그에새입니다. 둥지를 낮은 곳에 숨겨 새끼를 키웁니다. 땅 가까운 곳에 작은 비밀방을 마련하는 셈입니다.,Jean,draft,206_Red_legged_Partridge_VO_1.wav,1,Red legged Partridge. Partridges nest on the ground. They don't generally roost in pear trees.,75
207,Theklas Lark,스에크르아스종다리,스에크르아스종다리입니다. 이름 속에 생김새나 오래된 이야기가 숨어 있습니다. 카드를 볼 때 이름부터 한 번 더 들여다볼 만합니다.,Jean,draft,207_Theklas_Lark_VO_1.wav,1,Theklas Lark was named by German zoologist Alfred Brem after his sister.,75
208,European Roller,에어오프이느르오르르어새,에어오프이느르오르르어새입니다. 서식지에 맞게 독특한 먹이 활동과 행동을 보여 주는 새입니다.,Jean,draft,208_European_Roller_VO_1.wav,1,European Roller. European Roller chicks will vomit on themselves to deter nearby predators.,75
209,Eurasian Golden Oriole,유라시아금빛꾀꼬리,유라시아금빛꾀꼬리입니다. 나무 구멍과 틈을 살려 둥지를 마련합니다. 숲의 빈방을 알뜰하게 고르는 건축가입니다.,Jean,draft,209_Eurasian_Golden_Oriole_VO_1.wav,1,Eurasian Golden Oriole. This bird builds a cup-shaped nest suspended under a branch high in a tree.,75
210,Eurasian Tree Sparrow,유라시아트르이참새,유라시아트르이참새입니다. 작은 몸집과 뚜렷한 울음소리로 숲과 초원에서 존재감을 드러냅니다.,Jean,draft,210_Eurasian_Tree_Sparrowt_VO_1.wav,1,Eurasian Tree Sparrowt. A traditional Japanese dance was inspired by the fluttering of the tree sparrow.,75
211,European Honey Buzzard,에어오프이느흐오느에이브우즈즈아르드새,에어오프이느흐오느에이브우즈즈아르드새입니다. 둥지를 짓는 방식에 이 새만의 꾀가 숨어 있습니다. 작은 집 하나에도 생존 전략이 들어갑니다.,Jean,draft,211_European_Honey_Buzzard_VO_1.wav,1,European Honey Buzzard. This species possesses long toes and claws to rake and excavate wasp nests.,75
212,Great Tit,큰트이트새,큰트이트새입니다. 작은 곤충을 놓치지 않는 눈썰미가 있습니다. 숲속의 미세한 움직임도 먹잇감이 됩니다.,Jean,draft,212_Great_Tit_VO_1.wav,1,Great Tit. Great tits have been known to use conifer needles as tools to pull insect larvae out of a tree.,75
213,Hawfinch,흐오프이느치새,흐오프이느치새입니다. 서식지에 맞게 독특한 먹이 활동과 행동을 보여 주는 새입니다.,Jean,draft,213_Hawfinch_VO_1.wav,1,Hawfinch. These birds can be difficult to see because they favor high branches.,75
214,Bullfinch,브우르르프이느치새,브우르르프이느치새입니다. 서식지에 맞게 독특한 먹이 활동과 행동을 보여 주는 새입니다.,Jean,draft,214_Bullfinch_VO_1.wav,1,Bullfinch. The Bullfinch feeds on the buds of fruit trees and is considered a pest in orchards.,75
215,Bluethroat,브르우에스러오아트새,브르우에스러오아트새입니다. 이름 속에 생김새나 오래된 이야기가 숨어 있습니다. 카드를 볼 때 이름부터 한 번 더 들여다볼 만합니다.,Jean,draft,215_Bluethroat_VO_1.wav,1,Bluethroat. The species named Svekika comes from the male's colors matching the Swedish flag.,75
216,Common Nightingale,일반느이그흐트이느그아르에새,일반느이그흐트이느그아르에새입니다. 울음소리에는 이 새만의 서명이 담겨 있습니다. 숲이나 들판에서 먼저 들리는 작은 소개장입니다.,Jean,draft,216_Common_Nightingale_VO_1.wav,1,Common Nightingale. Nightingale's song has been called one of the most beautiful sounds of nature.,75
217,European Robin,에어오프이느로빈,에어오프이느로빈입니다. 작은 몸집과 뚜렷한 울음소리로 숲과 초원에서 존재감을 드러냅니다.,Jean,draft,217_European_Robin_VO_1.wav,1,European Robin. Folklore says the good or bad fortune you bring to a Robin will come back to you.,75
218,White Backed Woodpecker,흰브아크에드딱따구리,흰브아크에드딱따구리입니다. 작은 곤충을 놓치지 않는 눈썰미가 있습니다. 숲속의 미세한 움직임도 먹잇감이 됩니다.,Jean,draft,218_White_Backed_Woodpecker_VO_1.wav,1,White Backed Woodpecker. This bird likes large forests with many dead trees and will follow forest fires and insect infestations.,75
219,Black Woodpecker 286205Xc,검은딱따구리,검은딱따구리입니다. 나무줄기를 타고 오르며 부리로 두드려 곤충이나 수액을 찾습니다.,Jean,draft,219_Black_Woodpecker_VO_1.wav,1,Black Woodpecker. Tree holes made by this bird provide homes for other species.,75
220,Parrot Crossbill,앵무,앵무입니다. 강한 부리와 사회적인 행동이 특징인 지능적인 새입니다.,Jean,draft,220_Parrot_Crossbill_VO_2.wav,2,Parrot Crossbill. The Parrot Crossbill is one of only five bird species in the world with a crossed bill.,75
221,European Bee Eater,에어오프이느브이이트어새,에어오프이느브이이트어새입니다. 구애 행동은 작은 무대 공연 같습니다. 날개와 깃털로 마음을 전하는 방식이 인상적입니다.,Jean,draft,221_European_Bee_Eater_VO_1.wav,1,European Bee Eater. Honey bees make up approximately three-quarters of this bird's diet.,75
222,Black Headed Gull,검은머리갈매기,검은머리갈매기입니다. 물가에서 물고기를 노리는 솜씨가 좋습니다. 잔잔한 수면 아래를 놓치지 않는 사냥꾼입니다.,Jean,draft,222_Black_Headed_Gull_VO_1.wav,1,Black Headed Gull. This species is an opportunistic feeder that will consume anything from scraps to fish.,75
223,Long Tailed Tit,르오느그꼬리트이트새,르오느그꼬리트이트새입니다. 둥지를 짓는 방식에 이 새만의 꾀가 숨어 있습니다. 작은 집 하나에도 생존 전략이 들어갑니다.,Jean,draft,223_Long_tailed_Tit_VO_1.wav,1,"Long tailed Tit. Long tailed Tit nests are an elaborate ball made from lichen, moss, and spider webs.",75
224,Common Blackbird,일반검은새,일반검은새입니다. 작은 몸집과 뚜렷한 울음소리로 숲과 초원에서 존재감을 드러냅니다.,Jean,draft,224_Common_Blackbird_VO_1.wav,1,Common Blackbird. This bird was made world famous by the Beatles.,75
225,Snowy Owl,흰올빼미,"흰올빼미입니다. 밤에 활동하는 맹금류로, 조용히 날아 먹이를 찾는 습성이 두드러집니다.",Jean,draft,225_Snowy_Owl_VO_1.wav,1,"Snowy Owl. These birds can eat 1,600 lemmings a year.",75
226,Red Knot,붉은크느오트새,붉은크느오트새입니다. 서식지에 맞게 독특한 먹이 활동과 행동을 보여 주는 새입니다.,Jean,draft,226_Red_Knot_VO_1.wav,1,Red knot. This bird has one of the longest migrations from the High Arctic to Chile and South Africa.,75
227,Black Tailed Godwit,검은꼬리갓윗새,검은꼬리갓윗새입니다. 해안과 습지 가장자리에서 긴 부리로 작은 먹이를 찾아냅니다.,Jean,draft,227_Black_Tailed_Godwit_VO_2.wav,2,Black Tailed Godwit. These birds are protected from hunting in much of Europe due to population declines.,75
228,Corsican Nuthatch Xv,크오르스이크아느동고비,크오르스이크아느동고비입니다. 서식지에 맞게 독특한 먹이 활동과 행동을 보여 주는 새입니다.,Jean,draft,228_Corsican_Nuthatch_VO_1.wav,1,Corsican Nuthatch. This vulnerable species is found only on the island of Corsica where it feeds on pine seeds.,75
229,European Turtle Dove,에어오프이느트어트르에비둘기,에어오프이느트어트르에비둘기입니다. 울음소리에는 이 새만의 서명이 담겨 있습니다. 숲이나 들판에서 먼저 들리는 작은 소개장입니다.,Jean,draft,229_European_Turtle_Dove_VO_1.wav,1,European Turtle Dove. Turtle doves are a symbol of love in the Song of Solomon and the 12 Days of Christmas.,75
230,Little Bustard,작은브우스트아르드새,작은브우스트아르드새입니다. 구애 행동은 작은 무대 공연 같습니다. 날개와 깃털로 마음을 전하는 방식이 인상적입니다.,Jean,draft,230_Little_Bustard_VO_2.wav,2,Little Bustard. Males have extensive mating displays involving foot stamping and aerial leaps.,75
231,Yellowhammer,이에르르오흐아므므어새,이에르르오흐아므므어새입니다. 울음소리에는 이 새만의 서명이 담겨 있습니다. 숲이나 들판에서 먼저 들리는 작은 소개장입니다.,Jean,draft,231_Yellowhammer_VO_1.wav,1,Yellowhammer. The Yellowhammer song influenced works by Robert Burns and Beethoven.,75
232,White Wagtail,흰우아그트에이르새,흰우아그트에이르새입니다. 서식지에 맞게 독특한 먹이 활동과 행동을 보여 주는 새입니다.,Jean,draft,232_White_Wagtail_VO_2.wav,2,White Wagtail. The White Wagtail is the national bird of Latvia.,75
233,Moltonis Warbler,므오르트오느이스워블러,므오르트오느이스워블러입니다. 작은 몸집과 뚜렷한 울음소리로 숲과 초원에서 존재감을 드러냅니다.,Jean,draft,233_Moltonis_Warbler_VO_1.wav,1,Moltonis Warbler. Moltoni was a 20th century Italian ornithologist.,75
234,Goldcrest,그오르드크르에스트새,그오르드크르에스트새입니다. 서식지에 맞게 독특한 먹이 활동과 행동을 보여 주는 새입니다.,Jean,draft,234_Goldcrest_VO_1.wav,1,Goldcrest. Legends said these tiny birds would hitch a ride in the tail feathers of eagles or owls.,75
235,Common Moorhen 281025Xc,일반므우르흐에느크스크새,일반므우르흐에느크스크새입니다. 둥지를 낮은 곳에 숨겨 새끼를 키웁니다. 땅 가까운 곳에 작은 비밀방을 마련하는 셈입니다.,Jean,draft,235_Common_Moorhen_VO_1.wav,1,"Common Moorhen. Moorhens may build nests floating in the water, on the ground, or in a bush.",75
236,Short Toed Treecreeper,시오르트트오에드트르이크르이프어새,시오르트트오에드트르이크르이프어새입니다. 작은 곤충을 놓치지 않는 눈썰미가 있습니다. 숲속의 미세한 움직임도 먹잇감이 됩니다.,Jean,draft,236_Short_Toed_Treecreeper_VO_1.wav,1,Short Toed Treecreeper. This bird uses its long beak to feed on insects hidden in tree bar crevices.,75
237,Eleonoras Falcon,에르에오느오르아스매,에르에오느오르아스매입니다. 둥지를 짓는 방식에 이 새만의 꾀가 숨어 있습니다. 작은 집 하나에도 생존 전략이 들어갑니다.,Jean,draft,237_eleonoras_Falcon_VO_1.wav,1,Eleonoras Falcon. Eleonora of Arborea was the first European ruler to outlaw hunting bird nests in 1392.,75
238,Northern Gannet,북부그아느느에트새,북부그아느느에트새입니다. 먹이를 노릴 때는 물이나 공기 속으로 과감히 뛰어듭니다. 망설임보다 속도가 먼저입니다.,Jean,draft,238_Northern_Gannet_VO_1.wav,1,"Northern Gannet. Northern Gannets are spectacular divers, piercing water at speeds up to 100 kilometers per hour.",75
239,Eurasian Sparrowhawk,유라시아스프아르르오흐오크새,유라시아스프아르르오흐오크새입니다. 작은 곤충을 놓치지 않는 눈썰미가 있습니다. 숲속의 미세한 움직임도 먹잇감이 됩니다.,Jean,draft,239_Eurasian_Sparrowhawk_VO_1.wav,1,Eurasian Sparrowhawk. Sparrowhawk populations declined with the introduction of agricultural insecticides.,75
240,Northern Goshawk,북부그오시오크새,북부그오시오크새입니다. 서식지에 맞게 독특한 먹이 활동과 행동을 보여 주는 새입니다.,Jean,draft,240_Northern_Goshawk_VO_1.wav,1,"Northern Goshawk. In the Middle Ages, only nobles were allowed to use goshawks and falconry.",75
241,Eastern Imperial Eagle,동부이므프어이아르수리,동부이므프어이아르수리입니다. 날카로운 시야와 강한 날개로 하늘을 누비는 맹금류입니다.,Jean,draft,241_Eastern_Imperial_Eagle_VO_1.wav,1,"Eastern Imperial Eagle. This was the heraldic bird of several monarchies, but very few of them remain.",75
242,Bonellis Eagle,브오느에르르이스수리,브오느에르르이스수리입니다. 날카로운 시야와 강한 날개로 하늘을 누비는 맹금류입니다.,Jean,draft,242_Bonellis_Eagle_VO_1.wav,1,"Bonellis Eagle. These eagles will eat over 200 animal species, but rely heavily on rabbits, partridges and pigeons.",75
