card_no,bird_name,bird_name_ko,tts_text,voice_tag,review_status,source_file_name,source_vo_id,source_transcript,source_score
317,North Island Brown Kiwi,느오르스이스르아느드갈색크이우이새,느오르스이스르아느드갈색크이우이새입니다. 알을 둘러싼 전략이 꽤 대담합니다. 조용한 둥지 안에서도 치열한 이야기가 벌어집니다.,Jean,draft,317_North_Island_Brown_Kiwi_VO_1.wav,1,North Island Brown Kiwi. The Brown Kiwi's egg grows to take up 20% of the mother's body mass before being laid.,75
318,Orange Footed Scrubfowl,주황프우트에드스크우브프오르새,주황프우트에드스크우브프오르새입니다. 둥지를 짓는 방식에 이 새만의 꾀가 숨어 있습니다. 작은 집 하나에도 생존 전략이 들어갑니다.,Jean,draft,318_Orange_Footed_Scrubfowl_VO_1.wav,1,Orange Footed Scrubfowl. The mound nests of scrubfowl may be as tall as 4.5 meters.,75
319,Pacific Black Duck,프아크이프이크검은오리,프아크이프이크검은오리입니다. 물가에서 생활하며 헤엄과 잠수를 활용해 먹이를 찾습니다.,Jean,draft,319_Pacific_Black_Duckl_VO_1.wav,1,Pacific Black Duck. Competition with non-native mallards has severely reduced the species numbers in New Zealand.,60
320,Peaceful Dove,프이크에프우르비둘기,프이크에프우르비둘기입니다. 울음소리에는 이 새만의 서명이 담겨 있습니다. 숲이나 들판에서 먼저 들리는 작은 소개장입니다.,Jean,draft,320_Peaceful_Dove_VO_1.wav,1,Peaceful Dove. This bird is sometimes called the doodle-doo because of its distinctive song.,75
321,Pesquets Parrot,프에스쿠에트스앵무,프에스쿠에트스앵무입니다. 강한 부리와 사회적인 행동이 특징인 지능적인 새입니다.,Jean,draft,321_Pesquets_Parrot_VO_1.wav,1,Pesquets parrot. This bird went viral on the internet as the Dracula parrot.,75
322,Pheasant Coucal,꿩,꿩입니다. 둥지를 짓는 방식에 이 새만의 꾀가 숨어 있습니다. 작은 집 하나에도 생존 전략이 들어갑니다.,Jean,draft,322_Pheasant_Coucal_VO_1.wav,1,"Pheasant Cuckoo. Unlike most other cuckoos, the Pheasant Cuckoo is not a nest parasite.",60
323,Pink Eared Duck,프이느크이르에드오리,프이느크이르에드오리입니다. 물가에서 생활하며 헤엄과 잠수를 활용해 먹이를 찾습니다.,Jean,draft,323_Pink_Eared_Duck_VO_1.wav,1,Pink Eared Duck. These ducks sometimes spin around in pairs to concentrate food in a vortex.,75
324,Plains Wanderer,프르에이느스우아느드어어새,프르에이느스우아느드어어새입니다. 울음소리에는 이 새만의 서명이 담겨 있습니다. 숲이나 들판에서 먼저 들리는 작은 소개장입니다.,Jean,draft,324_Plains_Wanderer_VO_1.wav,1,Plains Wanderer. This critically endangered bird is the only species in the family Pedionomidae.,75
325,Princess Stephanies Astrapia,프르이느크에스스스트에프아느이스아스트르아프이아새,프르이느크에스스스트에프아느이스아스트르아프이아새입니다. 이름 속에 생김새나 오래된 이야기가 숨어 있습니다. 카드를 볼 때 이름부터 한 번 더 들여다볼 만합니다.,Jean,draft,325_Princess_Stephanies_Astrapia_VO_1.wav,1,Princess Stephanies Astrapia. This bird was named in honor of Princess Stephanie of Belgium in 1884.,75
326,Pukeko,프우크에크오새,프우크에크오새입니다. 둥지를 짓는 방식에 이 새만의 꾀가 숨어 있습니다. 작은 집 하나에도 생존 전략이 들어갑니다.,Jean,draft,326_Pukeko_VO_1.wav,1,"Pukeko. These birds, also known as swamp hens, may form social groups that share nests and chick raising duties.",75
327,Rainbow Lorikeet,르에이느브오르오르이크이트새,르에이느브오르오르이크이트새입니다. 서식지에 맞게 독특한 먹이 활동과 행동을 보여 주는 새입니다.,Jean,draft,327_Rainbow_Lorikeet_VO_1.wav,1,Rainbow Lorikeet. Some wild lorikeets are so accustomed to humans they can be hand fed.,75
328,Red Wattlebird,붉은우아트트르에브어드새,붉은우아트트르에브어드새입니다. 서식지에 맞게 독특한 먹이 활동과 행동을 보여 주는 새입니다.,Jean,draft,328_Red_Wattlebird_VO_1.wav,1,Red Wattlebird. These noisy aggressive birds will drive off smaller birds from a good nectar source.,75
329,Red Backed Fairywren,붉은브아크에드프에이르이우르에느새,붉은브아크에드프에이르이우르에느새입니다. 서식지에 맞게 독특한 먹이 활동과 행동을 보여 주는 새입니다.,Jean,draft,329_Red_Backed_Fairywren_VO_1.wav,1,Red Backed Fairywren. These birds have been used to study the role that testosterone plays in breeding plumage.,75
330,Red Capped Robin,붉은크아프프에드로빈,붉은크아프프에드로빈입니다. 작은 몸집과 뚜렷한 울음소리로 숲과 초원에서 존재감을 드러냅니다.,Jean,draft,330_Red_Capped_Robin_VO_1.wav,1,These robins get their red pigment from food. Red plumage shows that they are healthy and well fed.,60
331,Red Necked Avocet,붉은느에크에드장다리물떼새,붉은느에크에드장다리물떼새입니다. 해안과 습지 가장자리에서 긴 부리로 작은 먹이를 찾아냅니다.,Jean,draft,331_Red_Necked_Avocet_VO_1.wav,1,"Red Necked Avocet. As Avocets sweep their bills from side to side through water, they snap up small invertebrates for food.",75
332,Red Winged Parrot,붉은날개앵무,붉은날개앵무입니다. 구애 행동은 작은 무대 공연 같습니다. 날개와 깃털로 마음을 전하는 방식이 인상적입니다.,Jean,draft,332_Red_Winged_Parrot_VO_1.wav,1,Red Winged Parrot. The male of this species has a blue back that he reveals in his mating display.,75
333,Regent Bowerbird,르에그에느트브오어브어드새,르에그에느트브오어브어드새입니다. 구애 행동은 작은 무대 공연 같습니다. 날개와 깃털로 마음을 전하는 방식이 인상적입니다.,Jean,draft,333_Regent_Bowerbird_VO_1.wav,1,"Bowerbirds decorate their bowers with items like paint, shells, and buttons to attract a mate.",60
334,Royal Spoonbill,르오이아르저어새,르오이아르저어새입니다. 둥지를 짓는 방식에 이 새만의 꾀가 숨어 있습니다. 작은 집 하나에도 생존 전략이 들어갑니다.,Jean,draft,334_Royal_Spoonbill_VO_1.wav,1,"Royal Spoonbill. Spoonbills nest in colonies, often alongside many other waterbirds.",75
335,Rufous Night Heron,적갈색밤왜가리,적갈색밤왜가리입니다. 알을 둘러싼 전략이 꽤 대담합니다. 조용한 둥지 안에서도 치열한 이야기가 벌어집니다.,Jean,draft,335_Rufous_Night_Heron_VO_1.wav,1,"Rufous Night Heron. In addition to invertebrates and fish, night herons eat eggs and chicks of other wetland birds.",75
336,Rufous Owl,적갈색올빼미,"적갈색올빼미입니다. 밤에 활동하는 맹금류로, 조용히 날아 먹이를 찾는 습성이 두드러집니다.",Jean,draft,336_Rufous_Owl_VO_1.wav,1,"Rufous Owl. This large owl will eat prey as large as possums, scrubfowl, and parrots.",75
337,Rufous Banded Honeyeater,적갈색브아느드에드흐오느에이이트어새,적갈색브아느드에드흐오느에이이트어새입니다. 서식지에 맞게 독특한 먹이 활동과 행동을 보여 주는 새입니다.,Jean,draft,337_Rufous_Banded_Honeyeater_VO_1.wav,1,Rufous Banded Honeyeater. Honeyeaters have a brush-tipped tongue that they use to gather nectar from flowers.,75
338,Sacred Kingfisher,스아크르에드물총새,스아크르에드물총새입니다. 물가에서 물고기를 노리는 솜씨가 좋습니다. 잔잔한 수면 아래를 놓치지 않는 사냥꾼입니다.,Jean,draft,338_Sacred_Kingfisher_VO_1.wav,1,"Sacred Kingfisher. Despite this bird's name, fish make up a small portion of its diet.",75
339,Silvereye,스이르브어에이에새,스이르브어에이에새입니다. 이름 속에 생김새나 오래된 이야기가 숨어 있습니다. 카드를 볼 때 이름부터 한 번 더 들여다볼 만합니다.,Jean,draft,339_Silvereye_VO_1.wav,1,Silvereye. This bird's name comes from the ring of white feathers around its eye.,75
340,South Island Robin,스아우스이스르아느드로빈,스아우스이스르아느드로빈입니다. 작은 곤충을 놓치지 않는 눈썰미가 있습니다. 숲속의 미세한 움직임도 먹잇감이 됩니다.,Jean,draft,340_South_Island_Robin_VO_1.wav,1,"South Island Robin. These robins search for insects on the ground, then cash extras on branches and in crevices.",75
341,Southern Cassowary,스아우스어느크아스스오아르이새,스아우스어느크아스스오아르이새입니다. 서식지에 맞게 독특한 먹이 활동과 행동을 보여 주는 새입니다.,Jean,draft,341_Southern_Cassowary_VO_1.wav,1,Southern Cassowary. These aggressive birds are important for dispersing the seeds of large fruits in the rainforest.,75
342,Spangled Drongo,스프아느그르에드바람까마귀,스프아느그르에드바람까마귀입니다. 울음소리에는 이 새만의 서명이 담겨 있습니다. 숲이나 들판에서 먼저 들리는 작은 소개장입니다.,Jean,draft,342_Spangled_Drongo_VO_1.wav,1,Spangled Drongo. This bird makes its own distinctive calls but also mimics other bird species.,75
343,Splendid Fairywren,스프르에느드이드프에이르이우르에느새,스프르에느드이드프에이르이우르에느새입니다. 둥지를 짓는 방식에 이 새만의 꾀가 숨어 있습니다. 작은 집 하나에도 생존 전략이 들어갑니다.,Jean,draft,343_Splendid_Fairywren_VO_1.wav,1,"Splendid Fairywren. These birds make dome-shaped nests with a side opening, often in a low bush.",75
344,Spotless Crake,스프오트르에스스크르아크에새,스프오트르에스스크르아크에새입니다. 서식지에 맞게 독특한 먹이 활동과 행동을 보여 주는 새입니다.,Jean,draft,344_Spotless_Crake_VO_1.wav,1,Spotless Crake. The Crake's eyes turn bright red as it matures.,75
345,Stubble Quail,스트우브브르에메추라기,스트우브브르에메추라기입니다. 주로 땅 위에서 생활하며 풀숲과 덤불 사이를 빠르게 오갑니다.,Jean,draft,345_Stubble_Quail_VO_1.wav,1,Stubble Quail. This common quail's kidneys are adapted to need very little water.,75
346,Sulphur Crested Cockatoo,스우르프어볏크오크아트우새,스우르프어볏크오크아트우새입니다. 무리를 이루면 풍경이 달라집니다. 한 마리가 아니라 하늘을 움직이는 작은 행렬이 됩니다.,Jean,draft,346_Sulphur_Crested_Cockatoo_VO_1.wav,1,"Sulphur Crested Cockatoo. While a flock of cockatoos is on the ground to feed, one bird often keeps guard from above.",75
347,Superb Lyrebird,스우프어브르이르에브어드새,스우프어브르이르에브어드새입니다. 구애 행동은 작은 무대 공연 같습니다. 날개와 깃털로 마음을 전하는 방식이 인상적입니다.,Jean,draft,347_Superb_Lyrebird_VO_1.wav,1,Superb Lyrebird. Male lyrebirds attract mates with their huge tails and an extraordinary ability for mimicry.,75
348,Tawny Frogmouth,트오느이개구리입쏙독새,트오느이개구리입쏙독새입니다. 깃털과 자세가 훌륭한 위장복이 됩니다. 눈앞에 있어도 풍경인 척 숨어 버립니다.,Jean,draft,348_Tawny_Frogmouth_VO_1.wav,1,Tawny Frogmouth. These nocturnal birds are masters of camouflage and are often mistaken for broken tree branches.,75
349,Tui,트우이새,트우이새입니다. 서식지에 맞게 독특한 먹이 활동과 행동을 보여 주는 새입니다.,Jean,draft,349_Tui_VO_1.wav,1,Tui. Maori were known to train these highly territorial birds to imitate human speech.,75
350,Wedge Tailed Eagle,우에드그에꼬리수리,우에드그에꼬리수리입니다. 날카로운 시야와 강한 날개로 하늘을 누비는 맹금류입니다.,Jean,draft,350_Wedge_Tailed_Eagle_VO_1.wav,1,"Wedgetailed Eagle. These eagles can take large prey including possums, kangaroos, and wallabies.",60
351,Welcome Swallow,우에르크오므에제비,우에르크오므에제비입니다. 이름 속에 생김새나 오래된 이야기가 숨어 있습니다. 카드를 볼 때 이름부터 한 번 더 들여다볼 만합니다.,Jean,draft,351_Welcome_Swallow_VO_1.wav,1,Welcome Swallow. This bird's name refers to it heralding spring in southern Australia.,75
352,White Bellied Sea Eagle,흰배스이수리,흰배스이수리입니다. 물가에서 물고기를 노리는 솜씨가 좋습니다. 잔잔한 수면 아래를 놓치지 않는 사냥꾼입니다.,Jean,draft,352_White_Bellied_Sea_Eagle_VO_1.wav,1,"White Bellied Sea Eagle. These eagles are skilled fishers and hunters, but also harass smaller raptors and steal prey.",75
353,White Breasted Woodswallow,흰가슴우우드스우아르르오새,흰가슴우우드스우아르르오새입니다. 서식지에 맞게 독특한 먹이 활동과 행동을 보여 주는 새입니다.,Jean,draft,353_White_Breasted_Woodswallow_VO_1.wav,1,White Breasted Woodswallow. These wood swallows often perch in a tightly packed row when at rest.,75
354,White Faced Heron,흰프아크에드왜가리,흰프아크에드왜가리입니다. 물가에서 물고기를 노리는 솜씨가 좋습니다. 잔잔한 수면 아래를 놓치지 않는 사냥꾼입니다.,Jean,draft,354_White_Faced_Heron_VO_1.wav,1,White Faced Heron. These widespread herons can sometimes be found raiding suburban fishponds.,75
355,Willie Wagtail,우이르르이우아그트에이르새,우이르르이우아그트에이르새입니다. 무리를 이루면 풍경이 달라집니다. 한 마리가 아니라 하늘을 움직이는 작은 행렬이 됩니다.,Jean,draft,355_Willie_Wagtail_VO_1.wav,1,Willie Wagtail. This bird joins mixed species flocks and steals food from smaller birds.,75
356,Wrybill,우르이브이르르새,우르이브이르르새입니다. 서식지에 맞게 독특한 먹이 활동과 행동을 보여 주는 새입니다.,Jean,draft,356_Wrybill_VO_1.wav,1,Wrybill. The Wrybill's beak always curves to the right. The shape may aid it in foraging under rocks.,75
357,Crested Ibis,볏따오기,볏따오기입니다. 습지와 얕은 물가에서 긴 다리와 부리를 활용해 먹이를 찾습니다.,Jean,draft,357_Crested_Ibis_VO_1.wav,1,"Crested Ibis. There were only 10 wild Crested Ibises in the 1980s, but breeding programs are reintroducing them.",75
358,Spoon Billed Sandpiper,스프우느부리도요새,스프우느부리도요새입니다. 울음소리에는 이 새만의 서명이 담겨 있습니다. 숲이나 들판에서 먼저 들리는 작은 소개장입니다.,Jean,draft,358_Spoon_Billed_Sandpiper_VO_1.wav,1,"In 2020, there were thought to be fewer than 200 breeding pairs of this critically endangered bird.",60
359,White Headed Duck,흰머리오리,흰머리오리입니다. 물가에서 생활하며 헤엄과 잠수를 활용해 먹이를 찾습니다.,Jean,draft,359_White_Headed_Duck_VO_1.wav,1,Droughts and agriculture have dried up the lakes that were this endangered bird's breeding habitat.,60
360,Greater Adjutant,큰아드지우트아느트새,큰아드지우트아느트새입니다. 서식지에 맞게 독특한 먹이 활동과 행동을 보여 주는 새입니다.,Jean,draft,360_Greater_Adjutant_VO_1.wav,1,Greater Adjutant. Widespread wetland loss led this bird to go from being one of the most common storks to the rarest.,75
361,Indian Vulture,이느드이아느독수리,이느드이아느독수리입니다. 날카로운 시야와 강한 날개로 하늘을 누비는 맹금류입니다.,Jean,draft,361_Indian_Vulture_VO_1.wav,1,Indian Vulture. India banned use of diclofenac in cattle in 2008 after it caused the death of millions of vultures.,75
362,Great Indian Bustard,큰이느드이아느브우스트아르드새,큰이느드이아느브우스트아르드새입니다. 울음소리에는 이 새만의 서명이 담겨 있습니다. 숲이나 들판에서 먼저 들리는 작은 소개장입니다.,Jean,draft,362_Great_Indian_Bustard_VO_1.wav,1,"Great Indian Bustard. This critically endangered bird can weigh as much as 18 kilograms, making it the heaviest flying bird.",75
363,Red Crowned Crane,붉은관두루미,붉은관두루미입니다. 습지와 얕은 물가에서 긴 다리와 부리를 활용해 먹이를 찾습니다.,Jean,draft,363_Red_Crowned_Crane_VO_1.wav,1,"This endangered crane is associated in different cultures with longevity, purity, and peace.",60
364,Large Billed Crow,르아르그에부리까마귀,르아르그에부리까마귀입니다. 영리하고 적응력이 뛰어나며 다양한 먹이를 활용하는 새입니다.,Jean,draft,364_Large_Billed_Crow_VO_1.wav,1,"Large Billed Crow. These gregarious crows will take advantage of almost any food source, living or dead.",75
365,Rook,르우크새,르우크새입니다. 둥지를 짓는 방식에 이 새만의 꾀가 숨어 있습니다. 작은 집 하나에도 생존 전략이 들어갑니다.,Jean,draft,365_Rook_VO_1.wav,1,Rook. The word rookery comes from these birds who nest in large colonies.,75
366,Brown Shrike,갈색때까치,"갈색때까치입니다. 먹이를 숨겨 두는 솜씨가 뛰어납니다. 계절이 바뀌기 전, 숲속 곳간을 차근차근 채웁니다.",Jean,draft,366_Brown_Shrike_VO_1.wav,1,Brown Shrike. The name lanius means butcher and was given because Shrike store their prey by hanging it.,75
367,Willow Tit,우이르르오트이트새,"우이르르오트이트새입니다. 먹이를 숨겨 두는 솜씨가 뛰어납니다. 계절이 바뀌기 전, 숲속 곳간을 차근차근 채웁니다.",Jean,draft,367_Willow_Tit_VO_1.wav,1,Willow Tit. These birds have been recorded storing up to 200 food items in a day.,75
368,House Crow,집까마귀,집까마귀입니다. 영리하고 적응력이 뛰어나며 다양한 먹이를 활용하는 새입니다.,Jean,draft,368_House_Crow_VO_1.wav,1,These food-catching birds can pass a test indicating they recognize themselves in a mirror.,60
369,Sri Lanka Blue Magpie,스르이르아느크아푸른까치,스르이르아느크아푸른까치입니다. 영리하고 적응력이 뛰어나며 다양한 먹이를 활용하는 새입니다.,Jean,draft,369_Sri_Lanka_Blue_Magpie_VO_1.wav,1,Sri Lanka Blue Magpie. This intelligent corvid rubs caterpillars on branches to remove their hairs before eating them.,75
370,Verditer Flycatcher,브어드이트어딱새,브어드이트어딱새입니다. 나뭇가지에서 기다리다가 날아오르는 곤충을 재빠르게 낚아챕니다.,Jean,draft,370_Verditer_Flycatcher_VO_1.wav,1,Verditer Flycatcher. The color Verditer is an intense blue made by adding chalk or whiting to a copper nitrate solution.,75
371,Himalayan Monal,흐이므아르에이아느므오느아르새,흐이므아르에이아느므오느아르새입니다. 서식지에 맞게 독특한 먹이 활동과 행동을 보여 주는 새입니다.,Jean,draft,371_Himalayan_Monal_VO_1.wav,1,"This is the national bird of Nepal and the state bird of Uttarakhand, India.",60
372,Graceful Prinia,그르아크에프우르프르이느이아새,그르아크에프우르프르이느이아새입니다. 둥지를 짓는 방식에 이 새만의 꾀가 숨어 있습니다. 작은 집 하나에도 생존 전략이 들어갑니다.,Jean,draft,372_Graceful_Prinia_VO_1.wav,1,"The Prinia's nest is an oval pouch woven out of grass, with a side entrance near the top.",60
373,Eurasian Treecreeper,유라시아트르이크르이프어새,유라시아트르이크르이프어새입니다. 서식지에 맞게 독특한 먹이 활동과 행동을 보여 주는 새입니다.,Jean,draft,373_Eurasian_Treecreeper_VO_1.wav,1,"Tree creepers forage by hopping up tree trunks, then fluttering down to the base of the next tree.",60
374,Oriental Magpie Robin,오르이느트아르까치로빈,오르이느트아르까치로빈입니다. 울음소리에는 이 새만의 서명이 담겨 있습니다. 숲이나 들판에서 먼저 들리는 작은 소개장입니다.,Jean,draft,374_Oriental_Magpie_Robin_VO_1.wav,1,Oriental Magpie Robin. This songbird is the national bird of Bangladesh where it is widespread.,75
375,Coppersmith Barbet,크오프프어스므이스브아르브에트새,크오프프어스므이스브아르브에트새입니다. 울음소리에는 이 새만의 서명이 담겨 있습니다. 숲이나 들판에서 먼저 들리는 작은 소개장입니다.,Jean,draft,375_Coppersmith_Barbet_VO_1.wav,1,This bird's call is a repetitive metallic tuck that sounds like a copper sheet being beaten.,60
376,Common Green Magpie,일반초록까치,일반초록까치입니다. 이름 속에 생김새나 오래된 이야기가 숨어 있습니다. 카드를 볼 때 이름부터 한 번 더 들여다볼 만합니다.,Jean,draft,376_Common_Green_Magpie_VO_1.wav,1,"Common Green Magpie. Despite its Latin name, this bird is generally found in the Himalayas in Southeast Asia, not China.",75
377,Great Spotted Woodpecker,큰점박이딱따구리,큰점박이딱따구리입니다. 나무줄기를 타고 오르며 부리로 두드려 곤충이나 수액을 찾습니다.,Jean,draft,377_Great_Spotted_Woodpecker_VO_1.wav,1,"Woodpeckers can make up to 12,000 pecs per day at around 20 pecs per second.",60
378,Azure Tit,아즈어에트이트새,아즈어에트이트새입니다. 서식지에 맞게 독특한 먹이 활동과 행동을 보여 주는 새입니다.,Jean,draft,378_Azure_Tit_VO_1.wav,1,Azure Tit. This species will hybridize with the Eurasian blue tit where their ranges overlap.,75
379,Scaly Breasted Munia,스크아르이가슴므우느이아새,스크아르이가슴므우느이아새입니다. 서식지에 맞게 독특한 먹이 활동과 행동을 보여 주는 새입니다.,Jean,draft,379_Scaly_Breasted_Munia_VO_1.wav,1,Scaly Breasted Munia. These social finches gain time to forage by sharing the work of looking out for predators.,75
380,Gray Wagtail,회색우아그트에이르새,회색우아그트에이르새입니다. 서식지에 맞게 독특한 먹이 활동과 행동을 보여 주는 새입니다.,Jean,draft,380_Gray_Wagtail_VO_1.wav,1,Gray Wagtail. Wagtails constantly move their tails up and down as they forage in the rocky areas and rivers.,75
381,Olive Backed Sunbird,오르이브에브아크에드스우느브어드새,오르이브에브아크에드스우느브어드새입니다. 작은 곤충을 놓치지 않는 눈썰미가 있습니다. 숲속의 미세한 움직임도 먹잇감이 됩니다.,Jean,draft,381_Olive_Backed_Sunbird_VO_1.wav,1,"Olive Backed Sunbird. Sunbirds feed largely on nectar, but they will also take insects, especially when feeding young.",75
382,White Browed Tit Warbler,흰브르오에드트이트워블러,흰브르오에드트이트워블러입니다. 작은 몸집과 뚜렷한 울음소리로 숲과 초원에서 존재감을 드러냅니다.,Jean,draft,382_White_Browed_Tit_Warbler_VO_1.wav,1,"These birds spend a lot of time in juniper thickets, making their colorful plumage hard to see.",60
383,Desert Wheatear,사막우이트이르새,사막우이트이르새입니다. 서식지에 맞게 독특한 먹이 활동과 행동을 보여 주는 새입니다.,Jean,draft,383_Desert_Wheatear_VO_1.wav,1,Desert Wheatear. The desert wheatears that breed in the arid areas of Central Asia over winter in northeast Africa.,75
384,Eurasian Hoopoe,유라시아흐우프오에새,유라시아흐우프오에새입니다. 작은 곤충을 놓치지 않는 눈썰미가 있습니다. 숲속의 미세한 움직임도 먹잇감이 됩니다.,Jean,draft,384_Eurasian_Hoopoe_VO_1.wav,1,Hoopoes use their long bills to extract insect larvae from the ground or surface litter.,60
385,White Crested Laughingthrush,흰볏르오이느그스러우시새,흰볏르오이느그스러우시새입니다. 서식지에 맞게 독특한 먹이 활동과 행동을 보여 주는 새입니다.,Jean,draft,385_White_Crested_Laughingthrush_VO_1.wav,1,White Crested Laughingthrush. These social birds can make loud outbursts that sound something like laughter.,75
386,Grandala,그르아느드아르아새,그르아느드아르아새입니다. 서식지에 맞게 독특한 먹이 활동과 행동을 보여 주는 새입니다.,Jean,draft,386_Grandala_VO_1.wav,1,This bird breeds above the treeline in the Himalayas.,60
387,Eurasian Coot,유라시아물닭,유라시아물닭입니다. 습지와 얕은 물가에서 긴 다리와 부리를 활용해 먹이를 찾습니다.,Jean,draft,387_Eurasian_Coot_VO_1.wav,1,"Coots have lobed toes, not webbed feet, that help them swim through water and walk on mud.",60
388,Rosy Starling,르오스이찌르레기,르오스이찌르레기입니다. 둥지를 짓는 방식에 이 새만의 꾀가 숨어 있습니다. 작은 집 하나에도 생존 전략이 들어갑니다.,Jean,draft,388_Rosy_Starling_VO_1.wav,1,Farmers in China have reduced pesticide use by encouraging these birds to nest near their fields.,60
389,Baya Weaver,브에이아우이브어새,브에이아우이브어새입니다. 나무 구멍과 틈을 살려 둥지를 마련합니다. 숲의 빈방을 알뜰하게 고르는 건축가입니다.,Jean,draft,389_Baya_Weaver_VO_1.wav,1,Baya Weaver. These gregarious birds may weave up to 60 nests in a single tree.,75
390,Green Bee Eater,초록브이이트어새,초록브이이트어새입니다. 작은 곤충을 놓치지 않는 눈썰미가 있습니다. 숲속의 미세한 움직임도 먹잇감이 됩니다.,Jean,draft,390_Green_Bee_Eater_VO_1.wav,1,These insectivores often roost in large groups.,60
