file_name,card_no,bird_name,vo_id,transcript,duration_seconds,detected_language,language_probability,error,bird_audio_bird_name,bird_audio_clip_count,bird_audio_clip_files,bird_audio_main_files
321_Pesquets_Parrot_VO_1_PL.wav,321,Pesquets Parrot,1_PL,It's a pizza.,10.144,en,1.000000,,Pesquets Parrot,3,src/AudioClip/321_Pesquets_Parrot_ XC593058_1_call.m4a|src/AudioClip/321_Pesquets_Parrot_ XC593058_2_call.m4a|src/AudioClip/321_Pesquets_Parrot_ XC593058_3_call_main.m4a,src/AudioClip/321_Pesquets_Parrot_ XC593058_3_call_main.m4a
322_Pheasant_Coucal_VO_1 #30397.wav,322,Pheasant Coucal,1 #30397,"Hello everyone, I am Pheasant Coucal and I am the owner of the Pheasant Coucal.",7.701,en,1.000000,,Pheasant Coucal,3,src/AudioClip/322_Pheasant_Coucal_XC722734_1_call.m4a|src/AudioClip/322_Pheasant_Coucal_XC722734_2_call.m4a|src/AudioClip/322_Pheasant_Coucal_XC722734_3_call.m4a,
322_Pheasant_Coucal_VO_1_PL.wav,322,Pheasant Coucal,1_PL,"COCAL BAGANCHI. If you want to find out more about COCAL COCAL BAGANCHI, COCAL BAGANCHI can be found in a COCAL COCAL BAGANCHI.",10.327,en,1.000000,,Pheasant Coucal,3,src/AudioClip/322_Pheasant_Coucal_XC722734_1_call.m4a|src/AudioClip/322_Pheasant_Coucal_XC722734_2_call.m4a|src/AudioClip/322_Pheasant_Coucal_XC722734_3_call.m4a,
323_Pink_Eared_Duck_VO_1 #30908.wav,323,Pink Eared Duck,1 #30908,"Hello, my name is Yosir Chang. I am from Shenzhen. I am from Shenzhen.",7.439,en,1.000000,,Pink Eared Duck,2,src/AudioClip/323_Pink_Eared_Duck_ XC611851_1_call.m4a|src/AudioClip/323_Pink_Eared_Duck_ XC611851_2_song.m4a,
323_Pink_Eared_Duck_VO_1_PL.wav,323,Pink Eared Duck,1_PL,"Whoopatonos. To which whoopatonos is the same as science or school and the same as the same as the other. But, we can't wait to find out more about it in a different way.",9.982,en,1.000000,,Pink Eared Duck,2,src/AudioClip/323_Pink_Eared_Duck_ XC611851_1_call.m4a|src/AudioClip/323_Pink_Eared_Duck_ XC611851_2_song.m4a,
324_Plains_Wanderer_VO_1 #31001.wav,324,Plains Wanderer,1 #31001,"Ling Quan. Zhe Zhong Ji, Dou Binh Wei, Danyang Lei, Shi Ling Quan, Ke Zhong, Wei Yi, Dao Wu Zhong.",6.617,en,1.000000,,Plains Wanderer,1,src/AudioClip/324_Plains_Wanderer_1_call.m4a,
324_Plains_Wanderer_VO_1_PL.wav,324,Plains Wanderer,1_PL,Dropiatica. Dropiatica ist jedenum gien simpset stavitjalem rojine dropiatic. Zostavas klesificovana jekko gatunek krittetunie zagrodzhonden.,10.458,en,1.000000,,Plains Wanderer,1,src/AudioClip/324_Plains_Wanderer_1_call.m4a,
325_Princess_Stephanies_Astrapia_VO_1 #31276.wav,325,Princess Stephanies Astrapia,1 #31276,Who are you? I am the Princess of the Moon. I am the Princess of the Moon. I am the Princess of the Moon.,9.440,en,1.000000,,Princess Stephanies Astrapia,3,src/AudioClip/325_Princess_Stephanies_Astrapia_ XC38104_1_call.m4a|src/AudioClip/325_Princess_Stephanies_Astrapia_ XC38104_2_call.m4a|src/AudioClip/325_Princess_Stephanies_Astrapia_ XC38104_3_call_main.m4a,src/AudioClip/325_Princess_Stephanies_Astrapia_ XC38104_3_call_main.m4a
325_Princess_Stephanies_Astrapia_VO_1_PL.wav,325,Princess Stephanies Astrapia,1_PL,"Astrapial Šnjantza. Łačińska nazvategoptaka, navyon zuje doch sjnśki belgizki, Stefanie Klotl de Kowork, Žońe arzeczentje austrijatskjego, Rudolf Habsburga.",13.706,en,1.000000,,Princess Stephanies Astrapia,3,src/AudioClip/325_Princess_Stephanies_Astrapia_ XC38104_1_call.m4a|src/AudioClip/325_Princess_Stephanies_Astrapia_ XC38104_2_call.m4a|src/AudioClip/325_Princess_Stephanies_Astrapia_ XC38104_3_call_main.m4a,src/AudioClip/325_Princess_Stephanies_Astrapia_ XC38104_3_call_main.m4a
326_Pukeko_VO_1 #31461.wav,326,Pukeko,1 #31461,"Aozhou zi shui qi. Zhe zhonya huizhou cheng, gong xiang zhou tao, he yang yi zhi za da shi hu zhinti.",8.021,en,1.000000,,Pukeko,3,src/AudioClip/326_Pukeko_XC609322_1_call.m4a|src/AudioClip/326_Pukeko_XC609322_2_call.m4a|src/AudioClip/326_Pukeko_XC609322_3_call.m4a,
326_Pukeko_VO_1_PL.wav,326,Pukeko,1_PL,"Modriuk Chemnen. Killka Samit's Modriuk Chemnen goes quadrally off to Samem Gneśjie, and, after a close-up of Piskland, Sporne is probably the only one who will be in the mod.",10.710,en,1.000000,,Pukeko,3,src/AudioClip/326_Pukeko_XC609322_1_call.m4a|src/AudioClip/326_Pukeko_XC609322_2_call.m4a|src/AudioClip/326_Pukeko_XC609322_3_call.m4a,
327_Rainbow_Lorikeet_VO_1 #32065.wav,327,Rainbow Lorikeet,1 #32065,"Hello, I'm Hong Yong-woo. My name is Hong Yong-woo, and I'm going to introduce you to you. I'm going to introduce you to you in a few minutes.",9.395,en,1.000000,,,0,,
327_Rainbow_Lorikeet_VO_1_PL.wav,327,Rainbow Lorikeet,1_PL,The,9.578,en,1.000000,,,0,,
328_Red_Wattlebird_VO_1 #34253.wav,328,Red Wattlebird,1 #34253,"How many of you have seen this? If you have seen this, I would like to thank you for your support.",8.708,en,1.000000,,Red Wattlebird,3,src/AudioClip/328_Red_Wattlebird_ XC609037_1_call.m4a|src/AudioClip/328_Red_Wattlebird_ XC609037_2_call.m4a|src/AudioClip/328_Red_Wattlebird_ XC609037_3_call_main.m4a,src/AudioClip/328_Red_Wattlebird_ XC609037_3_call_main.m4a
328_Red_Wattlebird_VO_1_PL.wav,328,Red Wattlebird,1_PL,"Corralitsa wits turvandy. Polska nazvatte gopte kannavyon zu e do character stich nicht turvandyk plamek, ktore mapo obustra nakshyin.",9.868,en,1.000000,,Red Wattlebird,3,src/AudioClip/328_Red_Wattlebird_ XC609037_1_call.m4a|src/AudioClip/328_Red_Wattlebird_ XC609037_2_call.m4a|src/AudioClip/328_Red_Wattlebird_ XC609037_3_call_main.m4a,src/AudioClip/328_Red_Wattlebird_ XC609037_3_call_main.m4a
329_Red_Backed_Fairywren_VO_1 #32289.wav,329,Red Backed Fairywren,1 #32289,Where are you from? Where are you from?,8.471,en,1.000000,,Red Backed Fairywren,3,src/AudioClip/329_Red_Backed_Fairywren_XC526668_1_call.m4a|src/AudioClip/329_Red_Backed_Fairywren_XC526668_2_call.m4a|src/AudioClip/329_Red_Backed_Fairywren_XC526668_3_call.m4a,
329_Red_Backed_Fairywren_VO_1_PL.wav,329,Red Backed Fairywren,1_PL,"Hvostka turvonogbiete. Na hvostka turvonogbiete, badanov povtestosteronu na opirzenyep takov.",8.638,en,1.000000,,Red Backed Fairywren,3,src/AudioClip/329_Red_Backed_Fairywren_XC526668_1_call.m4a|src/AudioClip/329_Red_Backed_Fairywren_XC526668_2_call.m4a|src/AudioClip/329_Red_Backed_Fairywren_XC526668_3_call.m4a,
32_Purple_Gallinule_VO_1 #31580.wav,32,Purple Gallinule,1 #31580,"When you look at your eyes, you can see the face of your eyes. You can see the eyes of your eyes, the eyes of your eyes.",6.791,en,1.000000,,Purple Gallinule,4,src/AudioClip/32_Purple_Gallinule_2855_1_call.m4a|src/AudioClip/32_Purple_Gallinule_2855_2_call.m4a|src/AudioClip/32_Purple_Gallinule_2855_3_song.m4a|src/AudioClip/32_Purple_Gallinule_2855_4_call_main.m4a,src/AudioClip/32_Purple_Gallinule_2855_4_call_main.m4a
32_Purple_Gallinule_VO_1_PL.wav,32,Purple Gallinule,1_PL,Sotanka Americańska. Dzienki długin paltzom sotanka może beśpiśnieprzneprządzaczam poliściakzli li wodnaj.,9.091,en,1.000000,,Purple Gallinule,4,src/AudioClip/32_Purple_Gallinule_2855_1_call.m4a|src/AudioClip/32_Purple_Gallinule_2855_2_call.m4a|src/AudioClip/32_Purple_Gallinule_2855_3_song.m4a|src/AudioClip/32_Purple_Gallinule_2855_4_call_main.m4a,src/AudioClip/32_Purple_Gallinule_2855_4_call_main.m4a
330_Red_Capped_Robin_VO_1 #32758.wav,330,Red Capped Robin,1 #32758,"Hello, everyone. Hello, everyone. My name is Zhuo Zhong. Hello, everyone. My name is",9.776,en,1.000000,,Red Capped Robin,2,src/AudioClip/330_Red_Capped_Robin_ XC382818_1_song.m4a|src/AudioClip/330_Red_Capped_Robin_ XC382818_2_song.m4a,
330_Red_Capped_Robin_VO_1_PL.wav,330,Red Capped Robin,1_PL,Skaleneck turvan hotel. Skaleneck zavgenta turvan kolor pur napier. She turvan amo pigmenta vi ftrimo van imporvieno.,9.834,en,1.000000,,Red Capped Robin,2,src/AudioClip/330_Red_Capped_Robin_ XC382818_1_song.m4a|src/AudioClip/330_Red_Capped_Robin_ XC382818_2_song.m4a,
331_Red_Necked_Avocet_VO_1 #33833.wav,331,Red Necked Avocet,1 #33833,"Hongqing fan zhui yi. Dao fan zhui yi za shui zhong, heng sa tam dani a hui shi, shi doi xiao xing uchi zhi dong, ben haru qi zhong, chan wei shi wu.",10.799,en,1.000000,,Red Necked Avocet,3,src/AudioClip/331_Red_Necked_Avocet_XC434170_1_call.m4a|src/AudioClip/331_Red_Necked_Avocet_XC434170_2_call.m4a|src/AudioClip/331_Red_Necked_Avocet_XC434170_3_call_main.m4a,src/AudioClip/331_Red_Necked_Avocet_XC434170_3_call_main.m4a
331_Red_Necked_Avocet_VO_1_PL.wav,331,Red Necked Avocet,1_PL,"Shablodjup australiski. Shablodjup is the best language in the world, and the best language in the world, and the best language in the world.",8.568,en,1.000000,,Red Necked Avocet,3,src/AudioClip/331_Red_Necked_Avocet_XC434170_1_call.m4a|src/AudioClip/331_Red_Necked_Avocet_XC434170_2_call.m4a|src/AudioClip/331_Red_Necked_Avocet_XC434170_3_call_main.m4a,src/AudioClip/331_Red_Necked_Avocet_XC434170_3_call_main.m4a
332_Red_Winged_Parrot_VO_1 #34562.wav,332,Red Winged Parrot,1 #34562,"Hong Shi Yong. Zhe Gao Wu Zhong Da Xiong Xing, Yoda Lan Se, De Beibo. Tamo Hui Zhe Zhe Zhe Pei Zhong, Zhan Shi Zhe Jian.",8.439,en,1.000000,,Red Winged Parrot,3,src/AudioClip/332_Red_Winged_Parrot_XC692378_1_call.m4a|src/AudioClip/332_Red_Winged_Parrot_XC692378_2_call.m4a|src/AudioClip/332_Red_Winged_Parrot_XC692378_3_call.m4a,
332_Red_Winged_Parrot_VO_1_PL.wav,332,Red Winged Parrot,1_PL,Craznopurka Tervanovsk Šidwe. Patras Godov. Samze Kraznopurka Tervanovsk Šidwe. Pokazuion Samizom Dol Nontansti Grbietuk. Dora jest. Chem Nony Bieska.,12.278,en,1.000000,,Red Winged Parrot,3,src/AudioClip/332_Red_Winged_Parrot_XC692378_1_call.m4a|src/AudioClip/332_Red_Winged_Parrot_XC692378_2_call.m4a|src/AudioClip/332_Red_Winged_Parrot_XC692378_3_call.m4a,
333_Regent_Bowerbird_VO_1 #34680.wav,333,Regent Bowerbird,1 #34680,Who is the best person in the world? Who is the best person in the world?,10.581,en,1.000000,,Regent Bowerbird,3,src/AudioClip/333_Regent_Bowerbird_ XC352951_1_call.m4a|src/AudioClip/333_Regent_Bowerbird_XC352951_1_call.m4a|src/AudioClip/333_Regent_Bowerbird_XC352951_2_call.m4a,
333_Regent_Bowerbird_VO_1_PL.wav,333,Regent Bowerbird,1_PL,"Altonnik Krullewski. Vpóże Godów, sánte Altonnik of Krullewski, boudoyon Altonkikt re dakóroyon dróbnymykolorovimiprzadmyótámyakógużíkyt mószálki, abys wabitsamizam.",13.723,en,1.000000,,Regent Bowerbird,3,src/AudioClip/333_Regent_Bowerbird_ XC352951_1_call.m4a|src/AudioClip/333_Regent_Bowerbird_XC352951_1_call.m4a|src/AudioClip/333_Regent_Bowerbird_XC352951_2_call.m4a,
334_Royal_Spoonbill_VO_1 #35689.wav,334,Royal Spoonbill,1 #35689,Hwang jia pi lu. Pi lu cheng chun chu chaw. Tong chak chu xiu doa chita shui nia i qi chu chaw.,7.170,en,1.000000,,Royal Spoonbill,3,src/AudioClip/334_Royal_Spoonbill_1_call.m4a|src/AudioClip/334_Royal_Spoonbill_2_call.m4a|src/AudioClip/334_Royal_Spoonbill_3_call_main.m4a,src/AudioClip/334_Royal_Spoonbill_3_call_main.m4a
334_Royal_Spoonbill_VO_1_PL.wav,334,Royal Spoonbill,1_PL,"Vazhan Akhrolovska. Vazhan Akhrolovska didn't have to go to colonia, so he published a new book on how to use it.",9.117,en,1.000000,,Royal Spoonbill,3,src/AudioClip/334_Royal_Spoonbill_1_call.m4a|src/AudioClip/334_Royal_Spoonbill_2_call.m4a|src/AudioClip/334_Royal_Spoonbill_3_call_main.m4a,src/AudioClip/334_Royal_Spoonbill_3_call_main.m4a
335_Rufous_Night_Heron_VO_1 #36411.wav,335,Rufous Night Heron,1 #36411,"Hello, I am Rufous Night Heron. My name is Rufous Night Heron, and my name is Rufous Night Heron.",8.126,en,1.000000,,Rufous Night Heron,2,src/AudioClip/335_Rufous_Night_Heron_XC434370_1_call.m4a|src/AudioClip/335_Rufous_Night_Heron_XC434370_2_call.m4a,
335_Rufous_Night_Heron_VO_1_PL.wav,335,Rufous Night Heron,1_PL,"Shlepovronor daVin. Tenga ton ek shlepovronor zivishen beskren gov tami, iribami, atag jayayami, and pisklen tami innek pitakov. Zami skuyon tek mokradwa.",12.109,en,1.000000,,Rufous Night Heron,2,src/AudioClip/335_Rufous_Night_Heron_XC434370_1_call.m4a|src/AudioClip/335_Rufous_Night_Heron_XC434370_2_call.m4a,
336_Rufous_Owl_VO_1 #36515.wav,336,Rufous Owl,1 #36515,Zhong ying xiao. Zhe zhong dai xing mao to ying kai zhi xiang fu shu zhong zhi he yong yang dada leo.,7.746,en,1.000000,,Rufous Owl,2,src/AudioClip/336_Rufous_Owl_XC142493_1_call.m4a|src/AudioClip/336_Rufous_Owl_XC142493_2_call.m4a,
336_Rufous_Owl_VO_1_PL.wav,336,Rufous Owl,1_PL,"Soveta Mascova. All of my Soveta Mascova versions have been added to my version, and I hope you don't forget to subscribe.",9.178,en,1.000000,,Rufous Owl,2,src/AudioClip/336_Rufous_Owl_XC142493_1_call.m4a|src/AudioClip/336_Rufous_Owl_XC142493_2_call.m4a,
337_Rufous_Banded_Honeyeater_VO_1 #36298.wav,337,Rufous Banded Honeyeater,1 #36298,Songbang we ming nao. Ximing nao yu ee ge bi shuà yi aan de shi jian. Tam yo tà lài zhìng huà tòo zhìng shi huà mì.,8.633,en,1.000000,,Rufous Banded Honeyeater,2,src/AudioClip/337_Rufous_Banded_Honeyeater_XC707997_1_call.m4a|src/AudioClip/337_Rufous_Banded_Honeyeater_XC707997_2_call_main.m4a,src/AudioClip/337_Rufous_Banded_Honeyeater_XC707997_2_call_main.m4a
337_Rufous_Banded_Honeyeater_VO_1_PL.wav,337,Rufous Banded Honeyeater,1_PL,"Pél koyat biało gardu. And in Zki Pél koyatov, son zakonton especial nimishto tetshkami, kotore uadfiyon zlizevanya nektaros kviatov.",11.268,en,1.000000,,Rufous Banded Honeyeater,2,src/AudioClip/337_Rufous_Banded_Honeyeater_XC707997_1_call.m4a|src/AudioClip/337_Rufous_Banded_Honeyeater_XC707997_2_call_main.m4a,src/AudioClip/337_Rufous_Banded_Honeyeater_XC707997_2_call_main.m4a
338_Sacred_Kingfisher_VO_1 #36630.wav,338,Sacred Kingfisher,1 #36630,Bai mei fei zhui. Jingguan zhi dong nia dai ying wen ming zi li yong yi. Dang yi zhi jai tai shu wu dai yi xiao bu fen.,8.604,en,1.000000,,Sacred Kingfisher,3,src/AudioClip/338_Sacred_Kingfisher_XC689356_1_call.m4a|src/AudioClip/338_Sacred_Kingfisher_XC689356_2_call.m4a|src/AudioClip/338_Sacred_Kingfisher_XC689356_3_call_main.m4a,src/AudioClip/338_Sacred_Kingfisher_XC689356_3_call_main.m4a
338_Sacred_Kingfisher_VO_1_PL.wav,338,Sacred Kingfisher,1_PL,Woftuktterne. Woftuktterne ist shendemptakiam vivirenech polinesitukuf.,7.671,en,1.000000,,Sacred Kingfisher,3,src/AudioClip/338_Sacred_Kingfisher_XC689356_1_call.m4a|src/AudioClip/338_Sacred_Kingfisher_XC689356_2_call.m4a|src/AudioClip/338_Sacred_Kingfisher_XC689356_3_call_main.m4a,src/AudioClip/338_Sacred_Kingfisher_XC689356_3_call_main.m4a
339_Silvereye_VO_1 #37814.wav,339,Silvereye,1 #37814,How many of you have been here? How many of you have been here since the beginning of the year?,7.806,en,1.000000,,Silvereye,4,src/AudioClip/339_Silvereye_XC674040_1_call.m4a|src/AudioClip/339_Silvereye_XC674040_2_call.m4a|src/AudioClip/339_Silvereye_XC674040_3_song.m4a|src/AudioClip/339_Silvereye_XC674040_4_song.m4a,
339_Silvereye_VO_1_PL.wav,339,Silvereye,1_PL,Slarnik rdzavobotny Polska nazvategogatunko navyozu e dor dzavego ubarvinya uzbokuchawa,8.313,en,1.000000,,Silvereye,4,src/AudioClip/339_Silvereye_XC674040_1_call.m4a|src/AudioClip/339_Silvereye_XC674040_2_call.m4a|src/AudioClip/339_Silvereye_XC674040_3_song.m4a|src/AudioClip/339_Silvereye_XC674040_4_song.m4a,
33_wilsons_snipe_VO_1 #44626.wav,33,wilsons snipe,1 #44626,Wie shi sha zhui. Sha zhui de fishin su do ke dada shi su i bai gong li. Jie yo ji ji kao shou tenan qi sha tau tamen.,7.704,en,1.000000,,Wilsons Snipe,3,src/AudioClip/33_Wilsons_Snipe_94350_1_song.m4a|src/AudioClip/33_Wilsons_Snipe_94350_2_song.m4a|src/AudioClip/33_Wilsons_Snipe_94350_4_song_main.m4a,src/AudioClip/33_Wilsons_Snipe_94350_4_song_main.m4a
33_Wilsons_Snipe_VO_1_PL.wav,33,Wilsons Snipe,1_PL,"Bekas Americaniński. Bekas e på trafjån latte esprändkostjån navet stokkilåmetråf nagodjina, after the Turko-dobre-snyperjestvstvstanje jøstrallich.",11.710,en,1.000000,,Wilsons Snipe,3,src/AudioClip/33_Wilsons_Snipe_94350_1_song.m4a|src/AudioClip/33_Wilsons_Snipe_94350_2_song.m4a|src/AudioClip/33_Wilsons_Snipe_94350_4_song_main.m4a,src/AudioClip/33_Wilsons_Snipe_94350_4_song_main.m4a
340_South_Island_Robin_VO_1 #38684.wav,340,South Island Robin,1 #38684,Landau qi wong. Zhenjia zhi di shan so xing kun chong. Ria hou zai shu zhi he feng xi dong. Chan nih do yu de shi wong.,9.395,en,1.000000,,South Island Robin,4,src/AudioClip/340_South_Island_Robin_1_call.m4a|src/AudioClip/340_South_Island_Robin_2_call.m4a|src/AudioClip/340_South_Island_Robin_3_call_main.m4a|src/AudioClip/340_South_Island_Robin_4_song.m4a,src/AudioClip/340_South_Island_Robin_3_call_main.m4a
340_South_Island_Robin_VO_1_PL.wav,340,South Island Robin,1_PL,Skalenek vielkie. Skalenek vielkie is on avado gerna. Przegovoy on pożivignen nagavąńżek and Śtedina kskalnek.,9.596,en,1.000000,,South Island Robin,4,src/AudioClip/340_South_Island_Robin_1_call.m4a|src/AudioClip/340_South_Island_Robin_2_call.m4a|src/AudioClip/340_South_Island_Robin_3_call_main.m4a|src/AudioClip/340_South_Island_Robin_4_song.m4a,src/AudioClip/340_South_Island_Robin_3_call_main.m4a
341_Southern_Cassowary_VO_1 #38576.wav,341,Southern Cassowary,1 #38576,"Do you have any questions for me? If you have any questions, let us know in the comments below.",9.077,en,1.000000,,Southern Cassowary,3,src/AudioClip/341_Southern_Cassowary_XC132934_1_call.m4a|src/AudioClip/341_Southern_Cassowary_XC132934_2_call.m4a|src/AudioClip/341_Southern_Cassowary_XC132934_3_call.m4a,
341_Southern_Cassowary_VO_1_PL.wav,341,Southern Cassowary,1_PL,"Cazowar chau meastie. Cazowar chau meastie ist duscht agressive nymph takim, kutur e odgriva vahd norellen wros sie van nue nachen dže hov vot uv vdron gli.",10.658,en,1.000000,,Southern Cassowary,3,src/AudioClip/341_Southern_Cassowary_XC132934_1_call.m4a|src/AudioClip/341_Southern_Cassowary_XC132934_2_call.m4a|src/AudioClip/341_Southern_Cassowary_XC132934_3_call.m4a,
342_Spangled_Drongo_VO_1 #38786.wav,342,Spangled Drongo,1 #38786,I am a human being. I am not a human being. I am a human being. I am a human being.,7.558,en,1.000000,,Spangled Drongo,2,src/AudioClip/342_Spangled_Drongo_XC705143_1_call.m4a|src/AudioClip/342_Spangled_Drongo_XC705143_2_call.m4a,
342_Spangled_Drongo_VO_1_PL.wav,342,Spangled Drongo,1_PL,"Divogon wohate. Divogon wohate pothrachia un nachlado va di dvienki, vedavan epras in negaton kip takoff.",8.905,en,1.000000,,Spangled Drongo,2,src/AudioClip/342_Spangled_Drongo_XC705143_1_call.m4a|src/AudioClip/342_Spangled_Drongo_XC705143_2_call.m4a,
343_Splendid_Fairywren_VO_1 #38900.wav,343,Splendid Fairywren,1 #38900,Can you tell me what you think of Splendid Fairywren? Let us know in the comments below what you think of Splendid Fairywren.,8.977,en,1.000000,,Splendid Fairywren,3,src/AudioClip/343_Splendid_Fairywren_ XC689329_1_song.m4a|src/AudioClip/343_Splendid_Fairywren_ XC689329_2_song.m4a|src/AudioClip/343_Splendid_Fairywren_ XC689329_3_song.m4a,
343_Splendid_Fairywren_VO_1_PL.wav,343,Splendid Fairywren,1_PL,"Hvostka fspanyawa. Ten gatunek Hvostak, ten stovie kopu ovategnaz das Bochnenblotem, vniski zaroshlach.",8.594,en,1.000000,,Splendid Fairywren,3,src/AudioClip/343_Splendid_Fairywren_ XC689329_1_song.m4a|src/AudioClip/343_Splendid_Fairywren_ XC689329_2_song.m4a|src/AudioClip/343_Splendid_Fairywren_ XC689329_3_song.m4a,
344_Spotless_Crake_VO_1 #39124.wav,344,Spotless Crake,1 #39124,"Wuban Tianxi. Cheng Shuo Hao, Zhezunia de Yanzhiu, Huibian de Xianghong.",6.199,en,1.000000,,Spotless Crake,3,src/AudioClip/344_Spotless_Crake_XC329632_1_call.m4a|src/AudioClip/344_Spotless_Crake_XC329632_2_call.m4a|src/AudioClip/344_Spotless_Crake_XC329632_3_call_main.m4a,src/AudioClip/344_Spotless_Crake_XC329632_3_call_main.m4a
344_Spotless_Crake_VO_1_PL.wav,344,Spotless Crake,1_PL,"Correct cappos empna. Doros we osobniki correct cappos empna, mayo yas notarvone oto.",7.743,en,1.000000,,Spotless Crake,3,src/AudioClip/344_Spotless_Crake_XC329632_1_call.m4a|src/AudioClip/344_Spotless_Crake_XC329632_2_call.m4a|src/AudioClip/344_Spotless_Crake_XC329632_3_call_main.m4a,src/AudioClip/344_Spotless_Crake_XC329632_3_call_main.m4a
345_Stubble_Quail_VO_1 #40344.wav,345,Stubble Quail,1 #40344,"Ah, that's the end of the video. I hope that you will enjoy this video. Thank you very much for watching.",9.403,en,1.000000,,Stubble Quail,2,src/AudioClip/345_Stubble_Quail_XC688920_1_call.m4a|src/AudioClip/345_Stubble_Quail_XC688920_2_call.m4a,
345_Stubble_Quail_VO_1_PL.wav,345,Stubble Quail,1_PL,"Shepur karudogardua. Shepur karudogardua, bird dob jeprista savaashen do suhaego plimato. Yeesh lima dostamp do jellonech lychki yarna, mo je préje du besvodou.",13.224,en,1.000000,,Stubble Quail,2,src/AudioClip/345_Stubble_Quail_XC688920_1_call.m4a|src/AudioClip/345_Stubble_Quail_XC688920_2_call.m4a,
346_Sulphur_Crested_Cockatoo_VO_1 #40461.wav,346,Sulphur Crested Cockatoo,1 #40461,"Kweyohua feng tau yong wu. Dang Yui yong wu zai di sha mi shiche, zong shi wei ji zai sha feng wang feng.",8.589,en,1.000000,,Sulphur Crested Cockatoo,3,src/AudioClip/346_Sulphur_Crested_Cockatoo_XC634694_1_call.m4a|src/AudioClip/346_Sulphur_Crested_Cockatoo_XC634694_2_call.m4a|src/AudioClip/346_Sulphur_Crested_Cockatoo_XC634694_3_call_main.m4a,src/AudioClip/346_Sulphur_Crested_Cockatoo_XC634694_3_call_main.m4a
346_Sulphur_Crested_Cockatoo_VO_1_PL.wav,346,Sulphur Crested Cockatoo,1_PL,"Cockatoo jul totuba. Gde stado Cockatoo jeroo jena jemi, jeden osobnik opservooje autotenjes povietra y vrajes agrozegnya ostregda pozosta weptaki.",12.353,en,1.000000,,Sulphur Crested Cockatoo,3,src/AudioClip/346_Sulphur_Crested_Cockatoo_XC634694_1_call.m4a|src/AudioClip/346_Sulphur_Crested_Cockatoo_XC634694_2_call.m4a|src/AudioClip/346_Sulphur_Crested_Cockatoo_XC634694_3_call_main.m4a,src/AudioClip/346_Sulphur_Crested_Cockatoo_XC634694_3_call_main.m4a
347_Superb_Lyrebird_VO_1 #40653.wav,347,Superb Lyrebird,1 #40653,"Huali qin yao. Song xing huali qin yao, yi qi qi da de wei ba khe fei fai de mou fang na li xi yin peo.",8.185,en,1.000000,,Superb Lyrebird,3,src/AudioClip/347_Superb_Lyrebird_ XC609328_1_call.m4a|src/AudioClip/347_Superb_Lyrebird_ XC609328_2_call.m4a|src/AudioClip/347_Superb_Lyrebird_ XC609328_3_call_main.m4a,src/AudioClip/347_Superb_Lyrebird_ XC609328_3_call_main.m4a
347_Superb_Lyrebird_VO_1_PL.wav,347,Superb Lyrebird,1_PL,"Lyrogon of Spanielwe. Some say Lyrogon of Spanielwe goes vabryon samite ozdobnem ogonem, and pshupomynionsemi odugoce ototenia dvinkami.",10.333,en,1.000000,,Superb Lyrebird,3,src/AudioClip/347_Superb_Lyrebird_ XC609328_1_call.m4a|src/AudioClip/347_Superb_Lyrebird_ XC609328_2_call.m4a|src/AudioClip/347_Superb_Lyrebird_ XC609328_3_call_main.m4a,src/AudioClip/347_Superb_Lyrebird_ XC609328_3_call_main.m4a
348_Tawny_Frogmouth_VO_1 #40848.wav,348,Tawny Frogmouth,1 #40848,Can you give me a second one more? Can you give me a second one more? I will give you a second one more. I will give you a second one more.,8.992,en,1.000000,,Tawny Frogmouth,2,src/AudioClip/348_Tawny_Frogmouth_ XC434366_1_song_main.m4a|src/AudioClip/348_Tawny_Frogmouth_ XC434366_2_song.m4a,src/AudioClip/348_Tawny_Frogmouth_ XC434366_1_song_main.m4a
348_Tawny_Frogmouth_VO_1_PL.wav,348,Tawny Frogmouth,1_PL,Párstok australìskiin. Provodónce nozne tre grzecia Párstok ist mistrem kamuflaró. Trenstom ozhne gopomelich zesu a mano govän gendreva.,11.273,en,1.000000,,Tawny Frogmouth,2,src/AudioClip/348_Tawny_Frogmouth_ XC434366_1_song_main.m4a|src/AudioClip/348_Tawny_Frogmouth_ XC434366_2_song.m4a,src/AudioClip/348_Tawny_Frogmouth_ XC434366_1_song_main.m4a
349_Tui_VO_1 #41448.wav,349,Tui,1 #41448,"Hello, my name is Ximin. Hello, my name is Mollie. I'm from Tui. I'm from Tui. I'm from Tui. I'm from Tui.",8.484,en,1.000000,,Tui,6,src/AudioClip/349_Tui_XC656719_1_call.m4a|src/AudioClip/349_Tui_XC656719_2_call.m4a|src/AudioClip/349_Tui_XC656719_3_call.m4a|src/AudioClip/349_Tui_XC656719_4_call.m4a|src/AudioClip/349_Tui_XC656719_5_call.m4a|src/AudioClip/349_Tui_XC656719_6_call_main.m4a,src/AudioClip/349_Tui_XC656719_6_call_main.m4a
349_Tui_VO_1_PL.wav,349,Tui,1_PL,"Can you hear me? Can you hear me? My name is Shilny Rosevignent, Instant Territorial, and I will see you in the next video.",9.082,en,1.000000,,Tui,6,src/AudioClip/349_Tui_XC656719_1_call.m4a|src/AudioClip/349_Tui_XC656719_2_call.m4a|src/AudioClip/349_Tui_XC656719_3_call.m4a|src/AudioClip/349_Tui_XC656719_4_call.m4a|src/AudioClip/349_Tui_XC656719_5_call.m4a|src/AudioClip/349_Tui_XC656719_6_call_main.m4a,src/AudioClip/349_Tui_XC656719_6_call_main.m4a
34_Common_Loon_VO_1_PL.wav,34,Common Loon,1_PL,"Norr la Dovietz. Piref shimtegod new zhucia, piz klentan norraspen zhoyon wien krzestra sunnag zhbietze rojica.",7.930,en,1.000000,,Common Loon,4,src/AudioClip/34_Common_Loon_61311_1_call.m4a|src/AudioClip/34_Common_Loon_61311_2_call.m4a|src/AudioClip/34_Common_Loon_61311_3_call.m4a|src/AudioClip/34_Common_Loon_61311_4_call_main.m4a,src/AudioClip/34_Common_Loon_61311_4_call_main.m4a
350_Wedge_tailed_Eagle_VO_1 #42142.wav,350,Wedge tailed Eagle,1 #42142,"This is the end of the video. This is the end of the video. Please like, share and subscribe.",7.528,en,1.000000,,Wedge Tailed Eagle,3,src/AudioClip/350_Wedge_tailed_Eagle_1_call.m4a|src/AudioClip/350_Wedge_tailed_Eagle_2_call.m4a|src/AudioClip/350_Wedge_tailed_Eagle_3_call_main.m4a,src/AudioClip/350_Wedge_tailed_Eagle_3_call_main.m4a
350_Wedge_tailed_Eagle_VO_1_PL.wav,350,Wedge tailed Eagle,1_PL,"Hello, Australians! I hope you enjoyed this video, and if you enjoyed it, please like, share, and subscribe!",9.700,en,1.000000,,Wedge Tailed Eagle,3,src/AudioClip/350_Wedge_tailed_Eagle_1_call.m4a|src/AudioClip/350_Wedge_tailed_Eagle_2_call.m4a|src/AudioClip/350_Wedge_tailed_Eagle_3_call_main.m4a,src/AudioClip/350_Wedge_tailed_Eagle_3_call_main.m4a
351_Welcome_Swallow_VO_1 #42233.wav,351,Welcome Swallow,1 #42233,"Hello, I am I am from the United States. I am from the United States. I am from China.",7.304,en,1.000000,,Welcome Swallow,4,src/AudioClip/351_Welcome_Swallow_XC733564_1_call.m4a|src/AudioClip/351_Welcome_Swallow_XC733564_2_call.m4a|src/AudioClip/351_Welcome_Swallow_XC733564_3_call.m4a|src/AudioClip/351_Welcome_Swallow_XC733564_4_call.m4a,
